{
    "componentChunkName": "component---node-modules-rocketseat-gatsby-theme-docs-core-src-templates-docs-query-js",
    "path": "/docs/getting-started/adot-eks-add-on/config-otlp-ingest",
    "result": {"data":{"mdx":{"id":"476b9d3e-1198-5446-8e64-8684beb69a7c","excerpt":"The  OpenTelemetry Protocol (OTLP)  Ingest collector configuration launches a preconfigured OpenTelemetry Collector custom resource \nto ingest trace exportâ€¦","fields":{"slug":"/docs/getting-started/adot-eks-add-on/config-otlp-ingest/"},"frontmatter":{"title":"OTLP Ingest Collector Configuration","description":"This page introduces Collector configuration for OTLP Ingest for the ADOT Collector.","image":null,"disableTableOfContents":null},"body":"var _excluded = [\"components\"];\nfunction _extends() { _extends = Object.assign ? Object.assign.bind() : function (target) { for (var i = 1; i < arguments.length; i++) { var source = arguments[i]; for (var key in source) { if (Object.prototype.hasOwnProperty.call(source, key)) { target[key] = source[key]; } } } return target; }; return _extends.apply(this, arguments); }\nfunction _objectWithoutProperties(source, excluded) { if (source == null) return {}; var target = _objectWithoutPropertiesLoose(source, excluded); var key, i; if (Object.getOwnPropertySymbols) { var sourceSymbolKeys = Object.getOwnPropertySymbols(source); for (i = 0; i < sourceSymbolKeys.length; i++) { key = sourceSymbolKeys[i]; if (excluded.indexOf(key) >= 0) continue; if (!Object.prototype.propertyIsEnumerable.call(source, key)) continue; target[key] = source[key]; } } return target; }\nfunction _objectWithoutPropertiesLoose(source, excluded) { if (source == null) return {}; var target = {}; var sourceKeys = Object.keys(source); var key, i; for (i = 0; i < sourceKeys.length; i++) { key = sourceKeys[i]; if (excluded.indexOf(key) >= 0) continue; target[key] = source[key]; } return target; }\n/* @jsxRuntime classic */\n/* @jsx mdx */\n\nvar _frontmatter = {\n  \"title\": \"OTLP Ingest Collector Configuration\",\n  \"description\": \"This page introduces Collector configuration for OTLP Ingest for the ADOT Collector.\",\n  \"path\": \"/docs/getting-started/adot-eks-add-on/config-otlp-ingest\"\n};\nvar layoutProps = {\n  _frontmatter: _frontmatter\n};\nvar MDXLayout = \"wrapper\";\nreturn function MDXContent(_ref) {\n  var components = _ref.components,\n    props = _objectWithoutProperties(_ref, _excluded);\n  return mdx(MDXLayout, _extends({}, layoutProps, props, {\n    components: components,\n    mdxType: \"MDXLayout\"\n  }), mdx(\"p\", null, \"The \", mdx(\"a\", {\n    parentName: \"p\",\n    \"href\": \"https://opentelemetry.io/docs/specs/otlp/\"\n  }, \"OpenTelemetry Protocol (OTLP)\"), \" Ingest collector configuration launches a preconfigured OpenTelemetry Collector custom resource\\nto ingest trace export calls with the \", mdx(\"a\", {\n    parentName: \"p\",\n    \"href\": \"https://github.com/open-telemetry/opentelemetry-collector/tree/main/receiver/otlpreceiver\"\n  }, \"otlp\"), \" receiver. By opting into the\\n\", mdx(\"a\", {\n    parentName: \"p\",\n    \"href\": \"/docs/getting-started/adot-eks-add-on/config-otlp-ingest/#otlp-ingest-pipelines\"\n  }, \"available pipeline\"), \"\\nyou can control where the collected traces are sent. \"), mdx(\"h2\", {\n    \"id\": \"prerequisites\",\n    \"style\": {\n      \"position\": \"relative\"\n    }\n  }, mdx(\"a\", {\n    parentName: \"h2\",\n    \"href\": \"#prerequisites\",\n    \"aria-label\": \"prerequisites permalink\",\n    \"className\": \"anchor before\"\n  }, mdx(\"svg\", {\n    parentName: \"a\",\n    \"aria-hidden\": \"true\",\n    \"focusable\": \"false\",\n    \"height\": \"16\",\n    \"version\": \"1.1\",\n    \"viewBox\": \"0 0 16 16\",\n    \"width\": \"16\"\n  }, mdx(\"path\", {\n    parentName: \"svg\",\n    \"fillRule\": \"evenodd\",\n    \"d\": \"M4 9h1v1H4c-1.5 0-3-1.69-3-3.5S2.55 3 4 3h4c1.45 0 3 1.69 3 3.5 0 1.41-.91 2.72-2 3.25V8.59c.58-.45 1-1.27 1-2.09C10 5.22 8.98 4 8 4H4c-.98 0-2 1.22-2 2.5S3 9 4 9zm9-3h-1v1h1c1 0 2 1.22 2 2.5S13.98 12 13 12H9c-.98 0-2-1.22-2-2.5 0-.83.42-1.64 1-2.09V6.25c-1.09.53-2 1.84-2 3.25C6 11.31 7.55 13 9 13h4c1.45 0 3-1.69 3-3.5S14.5 6 13 6z\"\n  }))), \"Prerequisites\"), mdx(\"h3\", {\n    \"id\": \"setup-an-iam-role-to-associate-with-the-service-account\",\n    \"style\": {\n      \"position\": \"relative\"\n    }\n  }, mdx(\"a\", {\n    parentName: \"h3\",\n    \"href\": \"#setup-an-iam-role-to-associate-with-the-service-account\",\n    \"aria-label\": \"setup an iam role to associate with the service account permalink\",\n    \"className\": \"anchor before\"\n  }, mdx(\"svg\", {\n    parentName: \"a\",\n    \"aria-hidden\": \"true\",\n    \"focusable\": \"false\",\n    \"height\": \"16\",\n    \"version\": \"1.1\",\n    \"viewBox\": \"0 0 16 16\",\n    \"width\": \"16\"\n  }, mdx(\"path\", {\n    parentName: \"svg\",\n    \"fillRule\": \"evenodd\",\n    \"d\": \"M4 9h1v1H4c-1.5 0-3-1.69-3-3.5S2.55 3 4 3h4c1.45 0 3 1.69 3 3.5 0 1.41-.91 2.72-2 3.25V8.59c.58-.45 1-1.27 1-2.09C10 5.22 8.98 4 8 4H4c-.98 0-2 1.22-2 2.5S3 9 4 9zm9-3h-1v1h1c1 0 2 1.22 2 2.5S13.98 12 13 12H9c-.98 0-2-1.22-2-2.5 0-.83.42-1.64 1-2.09V6.25c-1.09.53-2 1.84-2 3.25C6 11.31 7.55 13 9 13h4c1.45 0 3-1.69 3-3.5S14.5 6 13 6z\"\n  }))), \"Setup an IAM role to associate with the service account\"), mdx(\"p\", null, \"An IAM Role with the following policies must be created for the following Kubernetes\\nservice account and namespace. \"), mdx(\"table\", null, mdx(\"thead\", {\n    parentName: \"table\"\n  }, mdx(\"tr\", {\n    parentName: \"thead\"\n  }, mdx(\"th\", {\n    parentName: \"tr\",\n    \"align\": null\n  }, \"Service Account Name\"), mdx(\"th\", {\n    parentName: \"tr\",\n    \"align\": null\n  }, \"Namespace\"), mdx(\"th\", {\n    parentName: \"tr\",\n    \"align\": null\n  }, \"IAM Policies\"))), mdx(\"tbody\", {\n    parentName: \"table\"\n  }, mdx(\"tr\", {\n    parentName: \"tbody\"\n  }, mdx(\"td\", {\n    parentName: \"tr\",\n    \"align\": null\n  }, mdx(\"nobr\", null, \"adot-col-otlp-ingest\")), mdx(\"td\", {\n    parentName: \"tr\",\n    \"align\": null\n  }, mdx(\"nobr\", null, \"opentelemetry-operator-system\")), mdx(\"td\", {\n    parentName: \"tr\",\n    \"align\": null\n  }, \"AWSXrayWriteOnlyAccess\")))), mdx(\"p\", null, mdx(\"strong\", {\n    parentName: \"p\"\n  }, \"Note:\"), \" Only attach the minimum set of policies necessary for your advanced configuration.\"), mdx(\"p\", null, \"The \", mdx(\"a\", {\n    parentName: \"p\",\n    \"href\": \"https://docs.aws.amazon.com/eks/latest/userguide/iam-roles-for-service-accounts.htmlhttps://docs.aws.amazon.com/eks/latest/userguide/iam-roles-for-service-accounts.html\"\n  }, \"IAM Roles for Service Accounts documentation (IRSA)\"), \" contains instructions for creating the IAM\\nrole. The following examples will use \", mdx(\"a\", {\n    parentName: \"p\",\n    \"href\": \"https://eksctl.io/usage/iamserviceaccounts/https://eksctl.io/usage/iamserviceaccounts/\"\n  }, \"eksctl\"), \" to achieve this. \"), mdx(\"p\", null, \"To create this IAM role, run the following command:\"), mdx(\"pre\", null, mdx(\"code\", {\n    parentName: \"pre\",\n    \"className\": \"language-console\"\n  }, \"eksctl create iamserviceaccount \\\\\\n    --name adot-col-otlp-ingest \\\\\\n    --namespace opentelemetry-operator-system \\\\\\n    --cluster <your_cluster_name> \\\\\\n    --attach-policy-arn arn:aws:iam::aws:policy/AWSXrayWriteOnlyAccess \\\\\\n    --approve \\\\\\n    --role-only\\n\")), mdx(\"p\", null, \"This IAM role generated by the above command needs to be inserted into the annotations\\nfield of the advanced configuration as seen below:\"), mdx(\"pre\", null, mdx(\"code\", {\n    parentName: \"pre\",\n    \"className\": \"language-yaml\"\n  }, \"collector:\\n  otlpIngest:\\n    serviceAccount:\\n      annotations:\\n        eks.amazonaws.com/role-arn: <iam_role_arn>\\n\")), mdx(\"h2\", {\n    \"id\": \"otlp-ingest-pipelines\",\n    \"style\": {\n      \"position\": \"relative\"\n    }\n  }, mdx(\"a\", {\n    parentName: \"h2\",\n    \"href\": \"#otlp-ingest-pipelines\",\n    \"aria-label\": \"otlp ingest pipelines permalink\",\n    \"className\": \"anchor before\"\n  }, mdx(\"svg\", {\n    parentName: \"a\",\n    \"aria-hidden\": \"true\",\n    \"focusable\": \"false\",\n    \"height\": \"16\",\n    \"version\": \"1.1\",\n    \"viewBox\": \"0 0 16 16\",\n    \"width\": \"16\"\n  }, mdx(\"path\", {\n    parentName: \"svg\",\n    \"fillRule\": \"evenodd\",\n    \"d\": \"M4 9h1v1H4c-1.5 0-3-1.69-3-3.5S2.55 3 4 3h4c1.45 0 3 1.69 3 3.5 0 1.41-.91 2.72-2 3.25V8.59c.58-.45 1-1.27 1-2.09C10 5.22 8.98 4 8 4H4c-.98 0-2 1.22-2 2.5S3 9 4 9zm9-3h-1v1h1c1 0 2 1.22 2 2.5S13.98 12 13 12H9c-.98 0-2-1.22-2-2.5 0-.83.42-1.64 1-2.09V6.25c-1.09.53-2 1.84-2 3.25C6 11.31 7.55 13 9 13h4c1.45 0 3-1.69 3-3.5S14.5 6 13 6z\"\n  }))), \"OTLP Ingest pipelines\"), mdx(\"p\", null, \"The following pipelines are available for the OTLP Ingest preconfigured custom resource.\\nPipelines can be enabled by setting their \", mdx(\"inlineCode\", {\n    parentName: \"p\"\n  }, \"enabled\"), \" field to \", mdx(\"inlineCode\", {\n    parentName: \"p\"\n  }, \"true\"), \". \"), mdx(\"h3\", {\n    \"id\": \"traces\",\n    \"style\": {\n      \"position\": \"relative\"\n    }\n  }, mdx(\"a\", {\n    parentName: \"h3\",\n    \"href\": \"#traces\",\n    \"aria-label\": \"traces permalink\",\n    \"className\": \"anchor before\"\n  }, mdx(\"svg\", {\n    parentName: \"a\",\n    \"aria-hidden\": \"true\",\n    \"focusable\": \"false\",\n    \"height\": \"16\",\n    \"version\": \"1.1\",\n    \"viewBox\": \"0 0 16 16\",\n    \"width\": \"16\"\n  }, mdx(\"path\", {\n    parentName: \"svg\",\n    \"fillRule\": \"evenodd\",\n    \"d\": \"M4 9h1v1H4c-1.5 0-3-1.69-3-3.5S2.55 3 4 3h4c1.45 0 3 1.69 3 3.5 0 1.41-.91 2.72-2 3.25V8.59c.58-.45 1-1.27 1-2.09C10 5.22 8.98 4 8 4H4c-.98 0-2 1.22-2 2.5S3 9 4 9zm9-3h-1v1h1c1 0 2 1.22 2 2.5S13.98 12 13 12H9c-.98 0-2-1.22-2-2.5 0-.83.42-1.64 1-2.09V6.25c-1.09.53-2 1.84-2 3.25C6 11.31 7.55 13 9 13h4c1.45 0 3-1.69 3-3.5S14.5 6 13 6z\"\n  }))), \"Traces\"), mdx(\"ul\", null, mdx(\"li\", {\n    parentName: \"ul\"\n  }, mdx(\"h4\", {\n    parentName: \"li\",\n    \"id\": \"xray\",\n    \"style\": {\n      \"position\": \"relative\"\n    }\n  }, mdx(\"a\", {\n    parentName: \"h4\",\n    \"href\": \"#xray\",\n    \"aria-label\": \"xray permalink\",\n    \"className\": \"anchor before\"\n  }, mdx(\"svg\", {\n    parentName: \"a\",\n    \"aria-hidden\": \"true\",\n    \"focusable\": \"false\",\n    \"height\": \"16\",\n    \"version\": \"1.1\",\n    \"viewBox\": \"0 0 16 16\",\n    \"width\": \"16\"\n  }, mdx(\"path\", {\n    parentName: \"svg\",\n    \"fillRule\": \"evenodd\",\n    \"d\": \"M4 9h1v1H4c-1.5 0-3-1.69-3-3.5S2.55 3 4 3h4c1.45 0 3 1.69 3 3.5 0 1.41-.91 2.72-2 3.25V8.59c.58-.45 1-1.27 1-2.09C10 5.22 8.98 4 8 4H4c-.98 0-2 1.22-2 2.5S3 9 4 9zm9-3h-1v1h1c1 0 2 1.22 2 2.5S13.98 12 13 12H9c-.98 0-2-1.22-2-2.5 0-.83.42-1.64 1-2.09V6.25c-1.09.53-2 1.84-2 3.25C6 11.31 7.55 13 9 13h4c1.45 0 3-1.69 3-3.5S14.5 6 13 6z\"\n  }))), \"xray\"), \"Traces collected by OTLP receiver are sent to AWS X-Ray.\")), mdx(\"h3\", {\n    \"id\": \"otlp-ingest-advanced-configuration-pipeline\",\n    \"style\": {\n      \"position\": \"relative\"\n    }\n  }, mdx(\"a\", {\n    parentName: \"h3\",\n    \"href\": \"#otlp-ingest-advanced-configuration-pipeline\",\n    \"aria-label\": \"otlp ingest advanced configuration pipeline permalink\",\n    \"className\": \"anchor before\"\n  }, mdx(\"svg\", {\n    parentName: \"a\",\n    \"aria-hidden\": \"true\",\n    \"focusable\": \"false\",\n    \"height\": \"16\",\n    \"version\": \"1.1\",\n    \"viewBox\": \"0 0 16 16\",\n    \"width\": \"16\"\n  }, mdx(\"path\", {\n    parentName: \"svg\",\n    \"fillRule\": \"evenodd\",\n    \"d\": \"M4 9h1v1H4c-1.5 0-3-1.69-3-3.5S2.55 3 4 3h4c1.45 0 3 1.69 3 3.5 0 1.41-.91 2.72-2 3.25V8.59c.58-.45 1-1.27 1-2.09C10 5.22 8.98 4 8 4H4c-.98 0-2 1.22-2 2.5S3 9 4 9zm9-3h-1v1h1c1 0 2 1.22 2 2.5S13.98 12 13 12H9c-.98 0-2-1.22-2-2.5 0-.83.42-1.64 1-2.09V6.25c-1.09.53-2 1.84-2 3.25C6 11.31 7.55 13 9 13h4c1.45 0 3-1.69 3-3.5S14.5 6 13 6z\"\n  }))), \"OTLP Ingest Advanced Configuration pipeline\"), mdx(\"pre\", null, mdx(\"code\", {\n    parentName: \"pre\",\n    \"className\": \"language-yaml\"\n  }, \"collector:\\n  otlpIngest:\\n    serviceAccount:\\n      annotations:\\n        eks.amazonaws.com/role-arn: <iam_role_arn>\\n    pipelines:\\n      traces:\\n        xray:\\n          enabled: true\\n\")), mdx(\"h2\", {\n    \"id\": \"otlp-ingest-configurable-values\",\n    \"style\": {\n      \"position\": \"relative\"\n    }\n  }, mdx(\"a\", {\n    parentName: \"h2\",\n    \"href\": \"#otlp-ingest-configurable-values\",\n    \"aria-label\": \"otlp ingest configurable values permalink\",\n    \"className\": \"anchor before\"\n  }, mdx(\"svg\", {\n    parentName: \"a\",\n    \"aria-hidden\": \"true\",\n    \"focusable\": \"false\",\n    \"height\": \"16\",\n    \"version\": \"1.1\",\n    \"viewBox\": \"0 0 16 16\",\n    \"width\": \"16\"\n  }, mdx(\"path\", {\n    parentName: \"svg\",\n    \"fillRule\": \"evenodd\",\n    \"d\": \"M4 9h1v1H4c-1.5 0-3-1.69-3-3.5S2.55 3 4 3h4c1.45 0 3 1.69 3 3.5 0 1.41-.91 2.72-2 3.25V8.59c.58-.45 1-1.27 1-2.09C10 5.22 8.98 4 8 4H4c-.98 0-2 1.22-2 2.5S3 9 4 9zm9-3h-1v1h1c1 0 2 1.22 2 2.5S13.98 12 13 12H9c-.98 0-2-1.22-2-2.5 0-.83.42-1.64 1-2.09V6.25c-1.09.53-2 1.84-2 3.25C6 11.31 7.55 13 9 13h4c1.45 0 3-1.69 3-3.5S14.5 6 13 6z\"\n  }))), \"OTLP Ingest configurable values\"), mdx(\"p\", null, \"Shown below is the complete list of configurable fields, along with their\\ndefault values, for the otlpIngest resource.\"), mdx(\"pre\", null, mdx(\"code\", {\n    parentName: \"pre\",\n    \"className\": \"language-yaml\"\n  }, \"collector:\\n  otlpIngest:\\n    resources:\\n      limits:\\n        cpu: 1000m\\n        memory: 750Mi\\n      requests:\\n        cpu: 300m\\n        memory: 512Mi\\n    serviceAccount:\\n      annotations:\\n    pipelines:\\n      traces:\\n        xray:\\n          enabled: false\\n\")), mdx(\"p\", null, \"*Note that in Fargate, resource requests and limits must be equal, see\\nthis \", mdx(\"a\", {\n    parentName: \"p\",\n    \"href\": \"https://docs.aws.amazon.com/eks/latest/userguide/troubleshooting-adot.html\"\n  }, \"troubleshooting guide\"), \" for more information.\"), mdx(\"h2\", {\n    \"id\": \"previous-topic-add-on-advanced-configuration-collector-deployment\",\n    \"style\": {\n      \"position\": \"relative\"\n    }\n  }, mdx(\"a\", {\n    parentName: \"h2\",\n    \"href\": \"#previous-topic-add-on-advanced-configuration-collector-deployment\",\n    \"aria-label\": \"previous topic add on advanced configuration collector deployment permalink\",\n    \"className\": \"anchor before\"\n  }, mdx(\"svg\", {\n    parentName: \"a\",\n    \"aria-hidden\": \"true\",\n    \"focusable\": \"false\",\n    \"height\": \"16\",\n    \"version\": \"1.1\",\n    \"viewBox\": \"0 0 16 16\",\n    \"width\": \"16\"\n  }, mdx(\"path\", {\n    parentName: \"svg\",\n    \"fillRule\": \"evenodd\",\n    \"d\": \"M4 9h1v1H4c-1.5 0-3-1.69-3-3.5S2.55 3 4 3h4c1.45 0 3 1.69 3 3.5 0 1.41-.91 2.72-2 3.25V8.59c.58-.45 1-1.27 1-2.09C10 5.22 8.98 4 8 4H4c-.98 0-2 1.22-2 2.5S3 9 4 9zm9-3h-1v1h1c1 0 2 1.22 2 2.5S13.98 12 13 12H9c-.98 0-2-1.22-2-2.5 0-.83.42-1.64 1-2.09V6.25c-1.09.53-2 1.84-2 3.25C6 11.31 7.55 13 9 13h4c1.45 0 3-1.69 3-3.5S14.5 6 13 6z\"\n  }))), mdx(\"a\", {\n    parentName: \"h2\",\n    \"href\": \"/docs/getting-started/adot-eks-add-on/add-on-configuration-collector-deployment\"\n  }, \"Previous Topic: Add-on Advanced Configuration: Collector Deployment\")), mdx(\"h2\", {\n    \"id\": \"related-topics\",\n    \"style\": {\n      \"position\": \"relative\"\n    }\n  }, mdx(\"a\", {\n    parentName: \"h2\",\n    \"href\": \"#related-topics\",\n    \"aria-label\": \"related topics permalink\",\n    \"className\": \"anchor before\"\n  }, mdx(\"svg\", {\n    parentName: \"a\",\n    \"aria-hidden\": \"true\",\n    \"focusable\": \"false\",\n    \"height\": \"16\",\n    \"version\": \"1.1\",\n    \"viewBox\": \"0 0 16 16\",\n    \"width\": \"16\"\n  }, mdx(\"path\", {\n    parentName: \"svg\",\n    \"fillRule\": \"evenodd\",\n    \"d\": \"M4 9h1v1H4c-1.5 0-3-1.69-3-3.5S2.55 3 4 3h4c1.45 0 3 1.69 3 3.5 0 1.41-.91 2.72-2 3.25V8.59c.58-.45 1-1.27 1-2.09C10 5.22 8.98 4 8 4H4c-.98 0-2 1.22-2 2.5S3 9 4 9zm9-3h-1v1h1c1 0 2 1.22 2 2.5S13.98 12 13 12H9c-.98 0-2-1.22-2-2.5 0-.83.42-1.64 1-2.09V6.25c-1.09.53-2 1.84-2 3.25C6 11.31 7.55 13 9 13h4c1.45 0 3-1.69 3-3.5S14.5 6 13 6z\"\n  }))), \"Related Topics:\"), mdx(\"h3\", {\n    \"id\": \"collector-configuration-for-prometheus-metrics\",\n    \"style\": {\n      \"position\": \"relative\"\n    }\n  }, mdx(\"a\", {\n    parentName: \"h3\",\n    \"href\": \"#collector-configuration-for-prometheus-metrics\",\n    \"aria-label\": \"collector configuration for prometheus metrics permalink\",\n    \"className\": \"anchor before\"\n  }, mdx(\"svg\", {\n    parentName: \"a\",\n    \"aria-hidden\": \"true\",\n    \"focusable\": \"false\",\n    \"height\": \"16\",\n    \"version\": \"1.1\",\n    \"viewBox\": \"0 0 16 16\",\n    \"width\": \"16\"\n  }, mdx(\"path\", {\n    parentName: \"svg\",\n    \"fillRule\": \"evenodd\",\n    \"d\": \"M4 9h1v1H4c-1.5 0-3-1.69-3-3.5S2.55 3 4 3h4c1.45 0 3 1.69 3 3.5 0 1.41-.91 2.72-2 3.25V8.59c.58-.45 1-1.27 1-2.09C10 5.22 8.98 4 8 4H4c-.98 0-2 1.22-2 2.5S3 9 4 9zm9-3h-1v1h1c1 0 2 1.22 2 2.5S13.98 12 13 12H9c-.98 0-2-1.22-2-2.5 0-.83.42-1.64 1-2.09V6.25c-1.09.53-2 1.84-2 3.25C6 11.31 7.55 13 9 13h4c1.45 0 3-1.69 3-3.5S14.5 6 13 6z\"\n  }))), mdx(\"a\", {\n    parentName: \"h3\",\n    \"href\": \"/docs/getting-started/adot-eks-add-on/config-prometheus-metrics\"\n  }, \"Collector Configuration for Prometheus Metrics\")), mdx(\"h3\", {\n    \"id\": \"collector-configuration-for-container-logs\",\n    \"style\": {\n      \"position\": \"relative\"\n    }\n  }, mdx(\"a\", {\n    parentName: \"h3\",\n    \"href\": \"#collector-configuration-for-container-logs\",\n    \"aria-label\": \"collector configuration for container logs permalink\",\n    \"className\": \"anchor before\"\n  }, mdx(\"svg\", {\n    parentName: \"a\",\n    \"aria-hidden\": \"true\",\n    \"focusable\": \"false\",\n    \"height\": \"16\",\n    \"version\": \"1.1\",\n    \"viewBox\": \"0 0 16 16\",\n    \"width\": \"16\"\n  }, mdx(\"path\", {\n    parentName: \"svg\",\n    \"fillRule\": \"evenodd\",\n    \"d\": \"M4 9h1v1H4c-1.5 0-3-1.69-3-3.5S2.55 3 4 3h4c1.45 0 3 1.69 3 3.5 0 1.41-.91 2.72-2 3.25V8.59c.58-.45 1-1.27 1-2.09C10 5.22 8.98 4 8 4H4c-.98 0-2 1.22-2 2.5S3 9 4 9zm9-3h-1v1h1c1 0 2 1.22 2 2.5S13.98 12 13 12H9c-.98 0-2-1.22-2-2.5 0-.83.42-1.64 1-2.09V6.25c-1.09.53-2 1.84-2 3.25C6 11.31 7.55 13 9 13h4c1.45 0 3-1.69 3-3.5S14.5 6 13 6z\"\n  }))), mdx(\"a\", {\n    parentName: \"h3\",\n    \"href\": \"/docs/getting-started/adot-eks-add-on/config-container-logs\"\n  }, \"Collector Configuration for Container Logs\")), mdx(\"h2\", {\n    \"id\": \"next-topic-updating-and-cleanup\",\n    \"style\": {\n      \"position\": \"relative\"\n    }\n  }, mdx(\"a\", {\n    parentName: \"h2\",\n    \"href\": \"#next-topic-updating-and-cleanup\",\n    \"aria-label\": \"next topic updating and cleanup permalink\",\n    \"className\": \"anchor before\"\n  }, mdx(\"svg\", {\n    parentName: \"a\",\n    \"aria-hidden\": \"true\",\n    \"focusable\": \"false\",\n    \"height\": \"16\",\n    \"version\": \"1.1\",\n    \"viewBox\": \"0 0 16 16\",\n    \"width\": \"16\"\n  }, mdx(\"path\", {\n    parentName: \"svg\",\n    \"fillRule\": \"evenodd\",\n    \"d\": \"M4 9h1v1H4c-1.5 0-3-1.69-3-3.5S2.55 3 4 3h4c1.45 0 3 1.69 3 3.5 0 1.41-.91 2.72-2 3.25V8.59c.58-.45 1-1.27 1-2.09C10 5.22 8.98 4 8 4H4c-.98 0-2 1.22-2 2.5S3 9 4 9zm9-3h-1v1h1c1 0 2 1.22 2 2.5S13.98 12 13 12H9c-.98 0-2-1.22-2-2.5 0-.83.42-1.64 1-2.09V6.25c-1.09.53-2 1.84-2 3.25C6 11.31 7.55 13 9 13h4c1.45 0 3-1.69 3-3.5S14.5 6 13 6z\"\n  }))), mdx(\"a\", {\n    parentName: \"h2\",\n    \"href\": \"/docs/getting-started/adot-eks-add-on/update-and-cleanup\"\n  }, \"Next Topic: Updating and Cleanup\")));\n}\n;\nMDXContent.isMDXComponent = true;","headings":[{"depth":2,"value":"Prerequisites"},{"depth":3,"value":"Setup an IAM role to associate with the service account"},{"depth":2,"value":"OTLP Ingest pipelines"},{"depth":3,"value":"Traces"},{"depth":4,"value":"xray"},{"depth":3,"value":"OTLP Ingest Advanced Configuration pipeline"},{"depth":2,"value":"OTLP Ingest configurable values"},{"depth":2,"value":"Previous Topic: Add-on Advanced Configuration: Collector Deployment"},{"depth":2,"value":"Related Topics:"},{"depth":3,"value":"Collector Configuration for Prometheus Metrics"},{"depth":3,"value":"Collector Configuration for Container Logs"},{"depth":2,"value":"Next Topic: Updating and Cleanup"}]}},"pageContext":{"slug":"/docs/getting-started/adot-eks-add-on/config-otlp-ingest/","repositoryEditUrl":"https://github.com/rocketseat/gatsby-themes/tree/main/examples/gatsby-theme-docs/src/docs/getting-started/adot-eks-add-on/config-otlp-ingest.mdx","repositoryProvider":"GitHub"}},
    "staticQueryHashes": ["2501019404","973074209"]}