{
    "componentChunkName": "component---node-modules-rocketseat-gatsby-theme-docs-core-src-templates-docs-query-js",
    "path": "/docs/getting-started/adot-eks-add-on/config-container-logs",
    "result": {"data":{"mdx":{"id":"c6ce3c93-ac83-5d94-beac-98a035f072d6","excerpt":"The Container Logs collector configuration launches a preconfigured OpenTelemetry Collector custom resource \nto tail all Kubernetes pod logs with the  filelogâ€¦","fields":{"slug":"/docs/getting-started/adot-eks-add-on/config-container-logs/"},"frontmatter":{"title":"Container Logs Collector Configuration","description":"This page introduces Collector configuration for Container Logs for the ADOT Collector.","image":null,"disableTableOfContents":null},"body":"var _excluded = [\"components\"];\nfunction _extends() { _extends = Object.assign ? Object.assign.bind() : function (target) { for (var i = 1; i < arguments.length; i++) { var source = arguments[i]; for (var key in source) { if (Object.prototype.hasOwnProperty.call(source, key)) { target[key] = source[key]; } } } return target; }; return _extends.apply(this, arguments); }\nfunction _objectWithoutProperties(source, excluded) { if (source == null) return {}; var target = _objectWithoutPropertiesLoose(source, excluded); var key, i; if (Object.getOwnPropertySymbols) { var sourceSymbolKeys = Object.getOwnPropertySymbols(source); for (i = 0; i < sourceSymbolKeys.length; i++) { key = sourceSymbolKeys[i]; if (excluded.indexOf(key) >= 0) continue; if (!Object.prototype.propertyIsEnumerable.call(source, key)) continue; target[key] = source[key]; } } return target; }\nfunction _objectWithoutPropertiesLoose(source, excluded) { if (source == null) return {}; var target = {}; var sourceKeys = Object.keys(source); var key, i; for (i = 0; i < sourceKeys.length; i++) { key = sourceKeys[i]; if (excluded.indexOf(key) >= 0) continue; target[key] = source[key]; } return target; }\n/* @jsxRuntime classic */\n/* @jsx mdx */\n\nvar _frontmatter = {\n  \"title\": \"Container Logs Collector Configuration\",\n  \"description\": \"This page introduces Collector configuration for Container Logs for the ADOT Collector.\",\n  \"path\": \"/docs/getting-started/adot-eks-add-on/config-container-logs\"\n};\nvar layoutProps = {\n  _frontmatter: _frontmatter\n};\nvar MDXLayout = \"wrapper\";\nreturn function MDXContent(_ref) {\n  var components = _ref.components,\n    props = _objectWithoutProperties(_ref, _excluded);\n  return mdx(MDXLayout, _extends({}, layoutProps, props, {\n    components: components,\n    mdxType: \"MDXLayout\"\n  }), mdx(\"p\", null, \"The Container Logs collector configuration launches a preconfigured OpenTelemetry Collector custom resource\\nto tail all Kubernetes pod logs with the \", mdx(\"a\", {\n    parentName: \"p\",\n    \"href\": \"https://github.com/open-telemetry/opentelemetry-collector-contrib/tree/main/receiver/filelogreceiver\"\n  }, \"filelog\"), \" receiver. By opting into the\\n\", mdx(\"a\", {\n    parentName: \"p\",\n    \"href\": \"/docs/getting-started/adot-eks-add-on/config-container-logs/#container-logs-pipelines\"\n  }, \"available pipeline\"), \"\\nyou can control where the collected logs are sent. In this preconfigured custom resource,\\nthe collector will run as a \", mdx(\"a\", {\n    parentName: \"p\",\n    \"href\": \"https://kubernetes.io/docs/concepts/workloads/controllers/daemonset/\"\n  }, \"DaemonSet\"), \" in order to capture all logs on each node.\"), mdx(\"h2\", {\n    \"id\": \"prerequisites\",\n    \"style\": {\n      \"position\": \"relative\"\n    }\n  }, mdx(\"a\", {\n    parentName: \"h2\",\n    \"href\": \"#prerequisites\",\n    \"aria-label\": \"prerequisites permalink\",\n    \"className\": \"anchor before\"\n  }, mdx(\"svg\", {\n    parentName: \"a\",\n    \"aria-hidden\": \"true\",\n    \"focusable\": \"false\",\n    \"height\": \"16\",\n    \"version\": \"1.1\",\n    \"viewBox\": \"0 0 16 16\",\n    \"width\": \"16\"\n  }, mdx(\"path\", {\n    parentName: \"svg\",\n    \"fillRule\": \"evenodd\",\n    \"d\": \"M4 9h1v1H4c-1.5 0-3-1.69-3-3.5S2.55 3 4 3h4c1.45 0 3 1.69 3 3.5 0 1.41-.91 2.72-2 3.25V8.59c.58-.45 1-1.27 1-2.09C10 5.22 8.98 4 8 4H4c-.98 0-2 1.22-2 2.5S3 9 4 9zm9-3h-1v1h1c1 0 2 1.22 2 2.5S13.98 12 13 12H9c-.98 0-2-1.22-2-2.5 0-.83.42-1.64 1-2.09V6.25c-1.09.53-2 1.84-2 3.25C6 11.31 7.55 13 9 13h4c1.45 0 3-1.69 3-3.5S14.5 6 13 6z\"\n  }))), \"Prerequisites\"), mdx(\"h3\", {\n    \"id\": \"setup-an-iam-role-to-associate-with-the-service-account\",\n    \"style\": {\n      \"position\": \"relative\"\n    }\n  }, mdx(\"a\", {\n    parentName: \"h3\",\n    \"href\": \"#setup-an-iam-role-to-associate-with-the-service-account\",\n    \"aria-label\": \"setup an iam role to associate with the service account permalink\",\n    \"className\": \"anchor before\"\n  }, mdx(\"svg\", {\n    parentName: \"a\",\n    \"aria-hidden\": \"true\",\n    \"focusable\": \"false\",\n    \"height\": \"16\",\n    \"version\": \"1.1\",\n    \"viewBox\": \"0 0 16 16\",\n    \"width\": \"16\"\n  }, mdx(\"path\", {\n    parentName: \"svg\",\n    \"fillRule\": \"evenodd\",\n    \"d\": \"M4 9h1v1H4c-1.5 0-3-1.69-3-3.5S2.55 3 4 3h4c1.45 0 3 1.69 3 3.5 0 1.41-.91 2.72-2 3.25V8.59c.58-.45 1-1.27 1-2.09C10 5.22 8.98 4 8 4H4c-.98 0-2 1.22-2 2.5S3 9 4 9zm9-3h-1v1h1c1 0 2 1.22 2 2.5S13.98 12 13 12H9c-.98 0-2-1.22-2-2.5 0-.83.42-1.64 1-2.09V6.25c-1.09.53-2 1.84-2 3.25C6 11.31 7.55 13 9 13h4c1.45 0 3-1.69 3-3.5S14.5 6 13 6z\"\n  }))), \"Setup an IAM role to associate with the service account\"), mdx(\"p\", null, \"An IAM Role with the following policies must be created for the following Kubernetes\\nservice account and namespace. \"), mdx(\"table\", null, mdx(\"thead\", {\n    parentName: \"table\"\n  }, mdx(\"tr\", {\n    parentName: \"thead\"\n  }, mdx(\"th\", {\n    parentName: \"tr\",\n    \"align\": null\n  }, \"Service Account Name\"), mdx(\"th\", {\n    parentName: \"tr\",\n    \"align\": null\n  }, \"Namespace\"), mdx(\"th\", {\n    parentName: \"tr\",\n    \"align\": null\n  }, \"IAM Policies\"))), mdx(\"tbody\", {\n    parentName: \"table\"\n  }, mdx(\"tr\", {\n    parentName: \"tbody\"\n  }, mdx(\"td\", {\n    parentName: \"tr\",\n    \"align\": null\n  }, mdx(\"nobr\", null, \"adot-col-container-logs\")), mdx(\"td\", {\n    parentName: \"tr\",\n    \"align\": null\n  }, mdx(\"nobr\", null, \"opentelemetry-operator-system\")), mdx(\"td\", {\n    parentName: \"tr\",\n    \"align\": null\n  }, \"CloudWatchAgentServerPolicy\")))), mdx(\"p\", null, mdx(\"strong\", {\n    parentName: \"p\"\n  }, \"Note:\"), \" Only attach the minimum set of policies necessary for your advanced configuration.\"), mdx(\"p\", null, \"The \", mdx(\"a\", {\n    parentName: \"p\",\n    \"href\": \"https://docs.aws.amazon.com/eks/latest/userguide/iam-roles-for-service-accounts.htmlhttps://docs.aws.amazon.com/eks/latest/userguide/iam-roles-for-service-accounts.html\"\n  }, \"IAM Roles for Service Accounts documentation (IRSA)\"), \" contains instructions for creating the IAM\\nrole. The following examples will use \", mdx(\"a\", {\n    parentName: \"p\",\n    \"href\": \"https://eksctl.io/usage/iamserviceaccounts/https://eksctl.io/usage/iamserviceaccounts/\"\n  }, \"eksctl\"), \" to achieve this. \"), mdx(\"p\", null, \"To create this IAM role, run the following command:\"), mdx(\"pre\", null, mdx(\"code\", {\n    parentName: \"pre\",\n    \"className\": \"language-console\"\n  }, \"eksctl create iamserviceaccount \\\\\\n    --name adot-col-container-logs \\\\\\n    --namespace opentelemetry-operator-system \\\\\\n    --cluster <your_cluster_name> \\\\\\n    --attach-policy-arn arn:aws:iam::aws:policy/CloudWatchAgentServerPolicy \\\\\\n    --approve \\\\\\n    --role-only\\n\")), mdx(\"p\", null, \"This IAM role generated by the above command needs to be inserted into the annotations\\nfield of the advanced configuration as seen below:\"), mdx(\"pre\", null, mdx(\"code\", {\n    parentName: \"pre\",\n    \"className\": \"language-yaml\"\n  }, \"collector:\\n  containerLogs:\\n    serviceAccount:\\n      annotations:\\n        eks.amazonaws.com/role-arn: <iam_role_arn>\\n\")), mdx(\"h2\", {\n    \"id\": \"container-logs-pipelines\",\n    \"style\": {\n      \"position\": \"relative\"\n    }\n  }, mdx(\"a\", {\n    parentName: \"h2\",\n    \"href\": \"#container-logs-pipelines\",\n    \"aria-label\": \"container logs pipelines permalink\",\n    \"className\": \"anchor before\"\n  }, mdx(\"svg\", {\n    parentName: \"a\",\n    \"aria-hidden\": \"true\",\n    \"focusable\": \"false\",\n    \"height\": \"16\",\n    \"version\": \"1.1\",\n    \"viewBox\": \"0 0 16 16\",\n    \"width\": \"16\"\n  }, mdx(\"path\", {\n    parentName: \"svg\",\n    \"fillRule\": \"evenodd\",\n    \"d\": \"M4 9h1v1H4c-1.5 0-3-1.69-3-3.5S2.55 3 4 3h4c1.45 0 3 1.69 3 3.5 0 1.41-.91 2.72-2 3.25V8.59c.58-.45 1-1.27 1-2.09C10 5.22 8.98 4 8 4H4c-.98 0-2 1.22-2 2.5S3 9 4 9zm9-3h-1v1h1c1 0 2 1.22 2 2.5S13.98 12 13 12H9c-.98 0-2-1.22-2-2.5 0-.83.42-1.64 1-2.09V6.25c-1.09.53-2 1.84-2 3.25C6 11.31 7.55 13 9 13h4c1.45 0 3-1.69 3-3.5S14.5 6 13 6z\"\n  }))), \"Container Logs pipelines\"), mdx(\"p\", null, \"The following pipelines are available for the Container Logs preconfigured custom resource.\\nPipelines can be enabled by setting their \", mdx(\"inlineCode\", {\n    parentName: \"p\"\n  }, \"enabled\"), \" field to \", mdx(\"inlineCode\", {\n    parentName: \"p\"\n  }, \"true\"), \". \"), mdx(\"h3\", {\n    \"id\": \"logs\",\n    \"style\": {\n      \"position\": \"relative\"\n    }\n  }, mdx(\"a\", {\n    parentName: \"h3\",\n    \"href\": \"#logs\",\n    \"aria-label\": \"logs permalink\",\n    \"className\": \"anchor before\"\n  }, mdx(\"svg\", {\n    parentName: \"a\",\n    \"aria-hidden\": \"true\",\n    \"focusable\": \"false\",\n    \"height\": \"16\",\n    \"version\": \"1.1\",\n    \"viewBox\": \"0 0 16 16\",\n    \"width\": \"16\"\n  }, mdx(\"path\", {\n    parentName: \"svg\",\n    \"fillRule\": \"evenodd\",\n    \"d\": \"M4 9h1v1H4c-1.5 0-3-1.69-3-3.5S2.55 3 4 3h4c1.45 0 3 1.69 3 3.5 0 1.41-.91 2.72-2 3.25V8.59c.58-.45 1-1.27 1-2.09C10 5.22 8.98 4 8 4H4c-.98 0-2 1.22-2 2.5S3 9 4 9zm9-3h-1v1h1c1 0 2 1.22 2 2.5S13.98 12 13 12H9c-.98 0-2-1.22-2-2.5 0-.83.42-1.64 1-2.09V6.25c-1.09.53-2 1.84-2 3.25C6 11.31 7.55 13 9 13h4c1.45 0 3-1.69 3-3.5S14.5 6 13 6z\"\n  }))), \"Logs\"), mdx(\"ul\", null, mdx(\"li\", {\n    parentName: \"ul\"\n  }, mdx(\"h4\", {\n    parentName: \"li\",\n    \"id\": \"cloudwatchlogs\",\n    \"style\": {\n      \"position\": \"relative\"\n    }\n  }, mdx(\"a\", {\n    parentName: \"h4\",\n    \"href\": \"#cloudwatchlogs\",\n    \"aria-label\": \"cloudwatchlogs permalink\",\n    \"className\": \"anchor before\"\n  }, mdx(\"svg\", {\n    parentName: \"a\",\n    \"aria-hidden\": \"true\",\n    \"focusable\": \"false\",\n    \"height\": \"16\",\n    \"version\": \"1.1\",\n    \"viewBox\": \"0 0 16 16\",\n    \"width\": \"16\"\n  }, mdx(\"path\", {\n    parentName: \"svg\",\n    \"fillRule\": \"evenodd\",\n    \"d\": \"M4 9h1v1H4c-1.5 0-3-1.69-3-3.5S2.55 3 4 3h4c1.45 0 3 1.69 3 3.5 0 1.41-.91 2.72-2 3.25V8.59c.58-.45 1-1.27 1-2.09C10 5.22 8.98 4 8 4H4c-.98 0-2 1.22-2 2.5S3 9 4 9zm9-3h-1v1h1c1 0 2 1.22 2 2.5S13.98 12 13 12H9c-.98 0-2-1.22-2-2.5 0-.83.42-1.64 1-2.09V6.25c-1.09.53-2 1.84-2 3.25C6 11.31 7.55 13 9 13h4c1.45 0 3-1.69 3-3.5S14.5 6 13 6z\"\n  }))), \"cloudwatchLogs\"), \"Logs collected by a filelog receiver are sent to Amazon CloudWatch Logs. \")), mdx(\"h3\", {\n    \"id\": \"container-logs-advanced-configuration-pipeline\",\n    \"style\": {\n      \"position\": \"relative\"\n    }\n  }, mdx(\"a\", {\n    parentName: \"h3\",\n    \"href\": \"#container-logs-advanced-configuration-pipeline\",\n    \"aria-label\": \"container logs advanced configuration pipeline permalink\",\n    \"className\": \"anchor before\"\n  }, mdx(\"svg\", {\n    parentName: \"a\",\n    \"aria-hidden\": \"true\",\n    \"focusable\": \"false\",\n    \"height\": \"16\",\n    \"version\": \"1.1\",\n    \"viewBox\": \"0 0 16 16\",\n    \"width\": \"16\"\n  }, mdx(\"path\", {\n    parentName: \"svg\",\n    \"fillRule\": \"evenodd\",\n    \"d\": \"M4 9h1v1H4c-1.5 0-3-1.69-3-3.5S2.55 3 4 3h4c1.45 0 3 1.69 3 3.5 0 1.41-.91 2.72-2 3.25V8.59c.58-.45 1-1.27 1-2.09C10 5.22 8.98 4 8 4H4c-.98 0-2 1.22-2 2.5S3 9 4 9zm9-3h-1v1h1c1 0 2 1.22 2 2.5S13.98 12 13 12H9c-.98 0-2-1.22-2-2.5 0-.83.42-1.64 1-2.09V6.25c-1.09.53-2 1.84-2 3.25C6 11.31 7.55 13 9 13h4c1.45 0 3-1.69 3-3.5S14.5 6 13 6z\"\n  }))), \"Container Logs Advanced Configuration pipeline\"), mdx(\"pre\", null, mdx(\"code\", {\n    parentName: \"pre\",\n    \"className\": \"language-yaml\"\n  }, \"collector:\\n  containerLogs:\\n    serviceAccount:\\n      annotations:\\n        eks.amazonaws.com/role-arn: <iam_role_arn>\\n    pipelines:\\n      logs:\\n        cloudwatchLogs:\\n          enabled: true\\n\")), mdx(\"h2\", {\n    \"id\": \"container-logs-exporters\",\n    \"style\": {\n      \"position\": \"relative\"\n    }\n  }, mdx(\"a\", {\n    parentName: \"h2\",\n    \"href\": \"#container-logs-exporters\",\n    \"aria-label\": \"container logs exporters permalink\",\n    \"className\": \"anchor before\"\n  }, mdx(\"svg\", {\n    parentName: \"a\",\n    \"aria-hidden\": \"true\",\n    \"focusable\": \"false\",\n    \"height\": \"16\",\n    \"version\": \"1.1\",\n    \"viewBox\": \"0 0 16 16\",\n    \"width\": \"16\"\n  }, mdx(\"path\", {\n    parentName: \"svg\",\n    \"fillRule\": \"evenodd\",\n    \"d\": \"M4 9h1v1H4c-1.5 0-3-1.69-3-3.5S2.55 3 4 3h4c1.45 0 3 1.69 3 3.5 0 1.41-.91 2.72-2 3.25V8.59c.58-.45 1-1.27 1-2.09C10 5.22 8.98 4 8 4H4c-.98 0-2 1.22-2 2.5S3 9 4 9zm9-3h-1v1h1c1 0 2 1.22 2 2.5S13.98 12 13 12H9c-.98 0-2-1.22-2-2.5 0-.83.42-1.64 1-2.09V6.25c-1.09.53-2 1.84-2 3.25C6 11.31 7.55 13 9 13h4c1.45 0 3-1.69 3-3.5S14.5 6 13 6z\"\n  }))), \"Container Logs exporters\"), mdx(\"p\", null, \"The following exporters can be configured for the Container Logs preconfigured custom resource.\"), mdx(\"h3\", {\n    \"id\": \"awscloudwatchlogs\",\n    \"style\": {\n      \"position\": \"relative\"\n    }\n  }, mdx(\"a\", {\n    parentName: \"h3\",\n    \"href\": \"#awscloudwatchlogs\",\n    \"aria-label\": \"awscloudwatchlogs permalink\",\n    \"className\": \"anchor before\"\n  }, mdx(\"svg\", {\n    parentName: \"a\",\n    \"aria-hidden\": \"true\",\n    \"focusable\": \"false\",\n    \"height\": \"16\",\n    \"version\": \"1.1\",\n    \"viewBox\": \"0 0 16 16\",\n    \"width\": \"16\"\n  }, mdx(\"path\", {\n    parentName: \"svg\",\n    \"fillRule\": \"evenodd\",\n    \"d\": \"M4 9h1v1H4c-1.5 0-3-1.69-3-3.5S2.55 3 4 3h4c1.45 0 3 1.69 3 3.5 0 1.41-.91 2.72-2 3.25V8.59c.58-.45 1-1.27 1-2.09C10 5.22 8.98 4 8 4H4c-.98 0-2 1.22-2 2.5S3 9 4 9zm9-3h-1v1h1c1 0 2 1.22 2 2.5S13.98 12 13 12H9c-.98 0-2-1.22-2-2.5 0-.83.42-1.64 1-2.09V6.25c-1.09.53-2 1.84-2 3.25C6 11.31 7.55 13 9 13h4c1.45 0 3-1.69 3-3.5S14.5 6 13 6z\"\n  }))), \"awscloudwatchlogs\"), mdx(\"ul\", null, mdx(\"li\", {\n    parentName: \"ul\"\n  }, mdx(\"h4\", {\n    parentName: \"li\",\n    \"id\": \"log_group_name\",\n    \"style\": {\n      \"position\": \"relative\"\n    }\n  }, mdx(\"a\", {\n    parentName: \"h4\",\n    \"href\": \"#log_group_name\",\n    \"aria-label\": \"log_group_name permalink\",\n    \"className\": \"anchor before\"\n  }, mdx(\"svg\", {\n    parentName: \"a\",\n    \"aria-hidden\": \"true\",\n    \"focusable\": \"false\",\n    \"height\": \"16\",\n    \"version\": \"1.1\",\n    \"viewBox\": \"0 0 16 16\",\n    \"width\": \"16\"\n  }, mdx(\"path\", {\n    parentName: \"svg\",\n    \"fillRule\": \"evenodd\",\n    \"d\": \"M4 9h1v1H4c-1.5 0-3-1.69-3-3.5S2.55 3 4 3h4c1.45 0 3 1.69 3 3.5 0 1.41-.91 2.72-2 3.25V8.59c.58-.45 1-1.27 1-2.09C10 5.22 8.98 4 8 4H4c-.98 0-2 1.22-2 2.5S3 9 4 9zm9-3h-1v1h1c1 0 2 1.22 2 2.5S13.98 12 13 12H9c-.98 0-2-1.22-2-2.5 0-.83.42-1.64 1-2.09V6.25c-1.09.53-2 1.84-2 3.25C6 11.31 7.55 13 9 13h4c1.45 0 3-1.69 3-3.5S14.5 6 13 6z\"\n  }))), \"log_group_name\"), mdx(\"p\", {\n    parentName: \"li\"\n  }, \"The name for the Amazon CloudWatch log group. Must follow pattern: \", mdx(\"inlineCode\", {\n    parentName: \"p\"\n  }, \"[\\\\\\\\.\\\\\\\\-_/#A-Za-z0-9]+\"))), mdx(\"li\", {\n    parentName: \"ul\"\n  }, mdx(\"h4\", {\n    parentName: \"li\",\n    \"id\": \"log_stream_name\",\n    \"style\": {\n      \"position\": \"relative\"\n    }\n  }, mdx(\"a\", {\n    parentName: \"h4\",\n    \"href\": \"#log_stream_name\",\n    \"aria-label\": \"log_stream_name permalink\",\n    \"className\": \"anchor before\"\n  }, mdx(\"svg\", {\n    parentName: \"a\",\n    \"aria-hidden\": \"true\",\n    \"focusable\": \"false\",\n    \"height\": \"16\",\n    \"version\": \"1.1\",\n    \"viewBox\": \"0 0 16 16\",\n    \"width\": \"16\"\n  }, mdx(\"path\", {\n    parentName: \"svg\",\n    \"fillRule\": \"evenodd\",\n    \"d\": \"M4 9h1v1H4c-1.5 0-3-1.69-3-3.5S2.55 3 4 3h4c1.45 0 3 1.69 3 3.5 0 1.41-.91 2.72-2 3.25V8.59c.58-.45 1-1.27 1-2.09C10 5.22 8.98 4 8 4H4c-.98 0-2 1.22-2 2.5S3 9 4 9zm9-3h-1v1h1c1 0 2 1.22 2 2.5S13.98 12 13 12H9c-.98 0-2-1.22-2-2.5 0-.83.42-1.64 1-2.09V6.25c-1.09.53-2 1.84-2 3.25C6 11.31 7.55 13 9 13h4c1.45 0 3-1.69 3-3.5S14.5 6 13 6z\"\n  }))), \"log_stream_name\"), mdx(\"p\", {\n    parentName: \"li\"\n  }, \"The name for the Amazon CloudWatch log stream. Must follow pattern: \", mdx(\"inlineCode\", {\n    parentName: \"p\"\n  }, \"[^:*]*\")))), mdx(\"h3\", {\n    \"id\": \"container-logs-advanced-configuration-exporters\",\n    \"style\": {\n      \"position\": \"relative\"\n    }\n  }, mdx(\"a\", {\n    parentName: \"h3\",\n    \"href\": \"#container-logs-advanced-configuration-exporters\",\n    \"aria-label\": \"container logs advanced configuration exporters permalink\",\n    \"className\": \"anchor before\"\n  }, mdx(\"svg\", {\n    parentName: \"a\",\n    \"aria-hidden\": \"true\",\n    \"focusable\": \"false\",\n    \"height\": \"16\",\n    \"version\": \"1.1\",\n    \"viewBox\": \"0 0 16 16\",\n    \"width\": \"16\"\n  }, mdx(\"path\", {\n    parentName: \"svg\",\n    \"fillRule\": \"evenodd\",\n    \"d\": \"M4 9h1v1H4c-1.5 0-3-1.69-3-3.5S2.55 3 4 3h4c1.45 0 3 1.69 3 3.5 0 1.41-.91 2.72-2 3.25V8.59c.58-.45 1-1.27 1-2.09C10 5.22 8.98 4 8 4H4c-.98 0-2 1.22-2 2.5S3 9 4 9zm9-3h-1v1h1c1 0 2 1.22 2 2.5S13.98 12 13 12H9c-.98 0-2-1.22-2-2.5 0-.83.42-1.64 1-2.09V6.25c-1.09.53-2 1.84-2 3.25C6 11.31 7.55 13 9 13h4c1.45 0 3-1.69 3-3.5S14.5 6 13 6z\"\n  }))), \"Container Logs Advanced Configuration exporters\"), mdx(\"pre\", null, mdx(\"code\", {\n    parentName: \"pre\",\n    \"className\": \"language-yaml\"\n  }, \"collector:\\n  containerLogs:\\n    serviceAccount:\\n      annotations:\\n        eks.amazonaws.com/role-arn: <iam_role_arn>\\n    pipelines:\\n      logs:\\n        cloudwatchLogs:\\n          enabled: true\\n    exporters:\\n      awscloudwatchlogs:\\n        log_group_name: <log_group_name>\\n        log_stream_name: <log_stream_name>\\n\")), mdx(\"h2\", {\n    \"id\": \"container-logs-configurable-values\",\n    \"style\": {\n      \"position\": \"relative\"\n    }\n  }, mdx(\"a\", {\n    parentName: \"h2\",\n    \"href\": \"#container-logs-configurable-values\",\n    \"aria-label\": \"container logs configurable values permalink\",\n    \"className\": \"anchor before\"\n  }, mdx(\"svg\", {\n    parentName: \"a\",\n    \"aria-hidden\": \"true\",\n    \"focusable\": \"false\",\n    \"height\": \"16\",\n    \"version\": \"1.1\",\n    \"viewBox\": \"0 0 16 16\",\n    \"width\": \"16\"\n  }, mdx(\"path\", {\n    parentName: \"svg\",\n    \"fillRule\": \"evenodd\",\n    \"d\": \"M4 9h1v1H4c-1.5 0-3-1.69-3-3.5S2.55 3 4 3h4c1.45 0 3 1.69 3 3.5 0 1.41-.91 2.72-2 3.25V8.59c.58-.45 1-1.27 1-2.09C10 5.22 8.98 4 8 4H4c-.98 0-2 1.22-2 2.5S3 9 4 9zm9-3h-1v1h1c1 0 2 1.22 2 2.5S13.98 12 13 12H9c-.98 0-2-1.22-2-2.5 0-.83.42-1.64 1-2.09V6.25c-1.09.53-2 1.84-2 3.25C6 11.31 7.55 13 9 13h4c1.45 0 3-1.69 3-3.5S14.5 6 13 6z\"\n  }))), \"Container Logs configurable values\"), mdx(\"p\", null, \"Shown below is the complete list of configurable fields, along with their default values, for the containerLogs resource.\\n\", mdx(\"inlineCode\", {\n    parentName: \"p\"\n  }, \"$CLUSTER_NAME\"), \" refers to the name of the EKS cluster and \", mdx(\"inlineCode\", {\n    parentName: \"p\"\n  }, \"$NODE_NAME\"), \" refers to the name of the Kubernetes node in the daemonset.\"), mdx(\"pre\", null, mdx(\"code\", {\n    parentName: \"pre\",\n    \"className\": \"language-yaml\"\n  }, \"collector:\\n  containerLogs:\\n    resources:\\n      limits:\\n        cpu: 1000m\\n        memory: 750Mi\\n      requests:\\n        cpu: 300m\\n        memory: 512Mi\\n    serviceAccount:\\n      annotations:\\n    pipelines:\\n      logs:\\n        cloudwatchLogs:\\n          enabled: false\\n    exporters:\\n      awscloudwatchlogs:\\n        log_group_name: $CLUSTER_NAME/container/logs\\n        log_stream_name: $NODE_NAME\\n\\n\")), mdx(\"p\", null, \"*Note that in Fargate, resource requests and limits must be equal, see\\nthis \", mdx(\"a\", {\n    parentName: \"p\",\n    \"href\": \"https://docs.aws.amazon.com/eks/latest/userguide/troubleshooting-adot.html\"\n  }, \"troubleshooting guide\"), \" for more information.\"), mdx(\"h2\", {\n    \"id\": \"previous-topic-add-on-advanced-configuration-collector-deployment\",\n    \"style\": {\n      \"position\": \"relative\"\n    }\n  }, mdx(\"a\", {\n    parentName: \"h2\",\n    \"href\": \"#previous-topic-add-on-advanced-configuration-collector-deployment\",\n    \"aria-label\": \"previous topic add on advanced configuration collector deployment permalink\",\n    \"className\": \"anchor before\"\n  }, mdx(\"svg\", {\n    parentName: \"a\",\n    \"aria-hidden\": \"true\",\n    \"focusable\": \"false\",\n    \"height\": \"16\",\n    \"version\": \"1.1\",\n    \"viewBox\": \"0 0 16 16\",\n    \"width\": \"16\"\n  }, mdx(\"path\", {\n    parentName: \"svg\",\n    \"fillRule\": \"evenodd\",\n    \"d\": \"M4 9h1v1H4c-1.5 0-3-1.69-3-3.5S2.55 3 4 3h4c1.45 0 3 1.69 3 3.5 0 1.41-.91 2.72-2 3.25V8.59c.58-.45 1-1.27 1-2.09C10 5.22 8.98 4 8 4H4c-.98 0-2 1.22-2 2.5S3 9 4 9zm9-3h-1v1h1c1 0 2 1.22 2 2.5S13.98 12 13 12H9c-.98 0-2-1.22-2-2.5 0-.83.42-1.64 1-2.09V6.25c-1.09.53-2 1.84-2 3.25C6 11.31 7.55 13 9 13h4c1.45 0 3-1.69 3-3.5S14.5 6 13 6z\"\n  }))), mdx(\"a\", {\n    parentName: \"h2\",\n    \"href\": \"/docs/getting-started/adot-eks-add-on/add-on-configuration-collector-deployment\"\n  }, \"Previous Topic: Add-on Advanced Configuration: Collector Deployment\")), mdx(\"h2\", {\n    \"id\": \"related-topics\",\n    \"style\": {\n      \"position\": \"relative\"\n    }\n  }, mdx(\"a\", {\n    parentName: \"h2\",\n    \"href\": \"#related-topics\",\n    \"aria-label\": \"related topics permalink\",\n    \"className\": \"anchor before\"\n  }, mdx(\"svg\", {\n    parentName: \"a\",\n    \"aria-hidden\": \"true\",\n    \"focusable\": \"false\",\n    \"height\": \"16\",\n    \"version\": \"1.1\",\n    \"viewBox\": \"0 0 16 16\",\n    \"width\": \"16\"\n  }, mdx(\"path\", {\n    parentName: \"svg\",\n    \"fillRule\": \"evenodd\",\n    \"d\": \"M4 9h1v1H4c-1.5 0-3-1.69-3-3.5S2.55 3 4 3h4c1.45 0 3 1.69 3 3.5 0 1.41-.91 2.72-2 3.25V8.59c.58-.45 1-1.27 1-2.09C10 5.22 8.98 4 8 4H4c-.98 0-2 1.22-2 2.5S3 9 4 9zm9-3h-1v1h1c1 0 2 1.22 2 2.5S13.98 12 13 12H9c-.98 0-2-1.22-2-2.5 0-.83.42-1.64 1-2.09V6.25c-1.09.53-2 1.84-2 3.25C6 11.31 7.55 13 9 13h4c1.45 0 3-1.69 3-3.5S14.5 6 13 6z\"\n  }))), \"Related Topics:\"), mdx(\"h3\", {\n    \"id\": \"collector-configuration-for-prometheus-metrics\",\n    \"style\": {\n      \"position\": \"relative\"\n    }\n  }, mdx(\"a\", {\n    parentName: \"h3\",\n    \"href\": \"#collector-configuration-for-prometheus-metrics\",\n    \"aria-label\": \"collector configuration for prometheus metrics permalink\",\n    \"className\": \"anchor before\"\n  }, mdx(\"svg\", {\n    parentName: \"a\",\n    \"aria-hidden\": \"true\",\n    \"focusable\": \"false\",\n    \"height\": \"16\",\n    \"version\": \"1.1\",\n    \"viewBox\": \"0 0 16 16\",\n    \"width\": \"16\"\n  }, mdx(\"path\", {\n    parentName: \"svg\",\n    \"fillRule\": \"evenodd\",\n    \"d\": \"M4 9h1v1H4c-1.5 0-3-1.69-3-3.5S2.55 3 4 3h4c1.45 0 3 1.69 3 3.5 0 1.41-.91 2.72-2 3.25V8.59c.58-.45 1-1.27 1-2.09C10 5.22 8.98 4 8 4H4c-.98 0-2 1.22-2 2.5S3 9 4 9zm9-3h-1v1h1c1 0 2 1.22 2 2.5S13.98 12 13 12H9c-.98 0-2-1.22-2-2.5 0-.83.42-1.64 1-2.09V6.25c-1.09.53-2 1.84-2 3.25C6 11.31 7.55 13 9 13h4c1.45 0 3-1.69 3-3.5S14.5 6 13 6z\"\n  }))), mdx(\"a\", {\n    parentName: \"h3\",\n    \"href\": \"/docs/getting-started/adot-eks-add-on/config-prometheus-metrics\"\n  }, \"Collector Configuration for Prometheus Metrics\")), mdx(\"h3\", {\n    \"id\": \"collector-configuration-for-otlp-ingest\",\n    \"style\": {\n      \"position\": \"relative\"\n    }\n  }, mdx(\"a\", {\n    parentName: \"h3\",\n    \"href\": \"#collector-configuration-for-otlp-ingest\",\n    \"aria-label\": \"collector configuration for otlp ingest permalink\",\n    \"className\": \"anchor before\"\n  }, mdx(\"svg\", {\n    parentName: \"a\",\n    \"aria-hidden\": \"true\",\n    \"focusable\": \"false\",\n    \"height\": \"16\",\n    \"version\": \"1.1\",\n    \"viewBox\": \"0 0 16 16\",\n    \"width\": \"16\"\n  }, mdx(\"path\", {\n    parentName: \"svg\",\n    \"fillRule\": \"evenodd\",\n    \"d\": \"M4 9h1v1H4c-1.5 0-3-1.69-3-3.5S2.55 3 4 3h4c1.45 0 3 1.69 3 3.5 0 1.41-.91 2.72-2 3.25V8.59c.58-.45 1-1.27 1-2.09C10 5.22 8.98 4 8 4H4c-.98 0-2 1.22-2 2.5S3 9 4 9zm9-3h-1v1h1c1 0 2 1.22 2 2.5S13.98 12 13 12H9c-.98 0-2-1.22-2-2.5 0-.83.42-1.64 1-2.09V6.25c-1.09.53-2 1.84-2 3.25C6 11.31 7.55 13 9 13h4c1.45 0 3-1.69 3-3.5S14.5 6 13 6z\"\n  }))), mdx(\"a\", {\n    parentName: \"h3\",\n    \"href\": \"/docs/getting-started/adot-eks-add-on/config-otlp-ingest\"\n  }, \"Collector Configuration for OTLP Ingest\")), mdx(\"h2\", {\n    \"id\": \"next-topic-updating-and-cleanup\",\n    \"style\": {\n      \"position\": \"relative\"\n    }\n  }, mdx(\"a\", {\n    parentName: \"h2\",\n    \"href\": \"#next-topic-updating-and-cleanup\",\n    \"aria-label\": \"next topic updating and cleanup permalink\",\n    \"className\": \"anchor before\"\n  }, mdx(\"svg\", {\n    parentName: \"a\",\n    \"aria-hidden\": \"true\",\n    \"focusable\": \"false\",\n    \"height\": \"16\",\n    \"version\": \"1.1\",\n    \"viewBox\": \"0 0 16 16\",\n    \"width\": \"16\"\n  }, mdx(\"path\", {\n    parentName: \"svg\",\n    \"fillRule\": \"evenodd\",\n    \"d\": \"M4 9h1v1H4c-1.5 0-3-1.69-3-3.5S2.55 3 4 3h4c1.45 0 3 1.69 3 3.5 0 1.41-.91 2.72-2 3.25V8.59c.58-.45 1-1.27 1-2.09C10 5.22 8.98 4 8 4H4c-.98 0-2 1.22-2 2.5S3 9 4 9zm9-3h-1v1h1c1 0 2 1.22 2 2.5S13.98 12 13 12H9c-.98 0-2-1.22-2-2.5 0-.83.42-1.64 1-2.09V6.25c-1.09.53-2 1.84-2 3.25C6 11.31 7.55 13 9 13h4c1.45 0 3-1.69 3-3.5S14.5 6 13 6z\"\n  }))), mdx(\"a\", {\n    parentName: \"h2\",\n    \"href\": \"/docs/getting-started/adot-eks-add-on/update-and-cleanup\"\n  }, \"Next Topic: Updating and Cleanup\")));\n}\n;\nMDXContent.isMDXComponent = true;","headings":[{"depth":2,"value":"Prerequisites"},{"depth":3,"value":"Setup an IAM role to associate with the service account"},{"depth":2,"value":"Container Logs pipelines"},{"depth":3,"value":"Logs"},{"depth":4,"value":"cloudwatchLogs"},{"depth":3,"value":"Container Logs Advanced Configuration pipeline"},{"depth":2,"value":"Container Logs exporters"},{"depth":3,"value":"awscloudwatchlogs"},{"depth":4,"value":"log_group_name"},{"depth":4,"value":"log_stream_name"},{"depth":3,"value":"Container Logs Advanced Configuration exporters"},{"depth":2,"value":"Container Logs configurable values"},{"depth":2,"value":"Previous Topic: Add-on Advanced Configuration: Collector Deployment"},{"depth":2,"value":"Related Topics:"},{"depth":3,"value":"Collector Configuration for Prometheus Metrics"},{"depth":3,"value":"Collector Configuration for OTLP Ingest"},{"depth":2,"value":"Next Topic: Updating and Cleanup"}]}},"pageContext":{"slug":"/docs/getting-started/adot-eks-add-on/config-container-logs/","repositoryEditUrl":"https://github.com/rocketseat/gatsby-themes/tree/main/examples/gatsby-theme-docs/src/docs/getting-started/adot-eks-add-on/config-container-logs.mdx","repositoryProvider":"GitHub"}},
    "staticQueryHashes": ["2501019404","973074209"]}