{
    "componentChunkName": "component---node-modules-rocketseat-gatsby-theme-docs-core-src-templates-docs-query-js",
    "path": "/docs/getting-started/adot-eks-add-on",
    "result": {"data":{"mdx":{"id":"cb829481-5d8c-5f2a-a5a1-a10d8efa46dd","excerpt":"Table of Contents Introduction Requirements Installation Add-on Advanced Configuration Collector Configuration Introduction Injecting Auto-instrumentationâ€¦","fields":{"slug":"/docs/getting-started/adot-eks-add-on/"},"frontmatter":{"title":"Getting Started with AWS Distro for OpenTelemetry using EKS Add-Ons","description":"This page is about getting started with leveraging Amazon EKS add-ons to use ADOT.","image":null,"disableTableOfContents":null},"body":"var _excluded = [\"components\"];\nfunction _extends() { _extends = Object.assign ? Object.assign.bind() : function (target) { for (var i = 1; i < arguments.length; i++) { var source = arguments[i]; for (var key in source) { if (Object.prototype.hasOwnProperty.call(source, key)) { target[key] = source[key]; } } } return target; }; return _extends.apply(this, arguments); }\nfunction _objectWithoutProperties(source, excluded) { if (source == null) return {}; var target = _objectWithoutPropertiesLoose(source, excluded); var key, i; if (Object.getOwnPropertySymbols) { var sourceSymbolKeys = Object.getOwnPropertySymbols(source); for (i = 0; i < sourceSymbolKeys.length; i++) { key = sourceSymbolKeys[i]; if (excluded.indexOf(key) >= 0) continue; if (!Object.prototype.propertyIsEnumerable.call(source, key)) continue; target[key] = source[key]; } } return target; }\nfunction _objectWithoutPropertiesLoose(source, excluded) { if (source == null) return {}; var target = {}; var sourceKeys = Object.keys(source); var key, i; for (i = 0; i < sourceKeys.length; i++) { key = sourceKeys[i]; if (excluded.indexOf(key) >= 0) continue; target[key] = source[key]; } return target; }\n/* @jsxRuntime classic */\n/* @jsx mdx */\n\nvar _frontmatter = {\n  \"title\": \"Getting Started with AWS Distro for OpenTelemetry using EKS Add-Ons\",\n  \"description\": \"This page is about getting started with leveraging Amazon EKS add-ons to use ADOT.\",\n  \"path\": \"/docs/getting-started/adot-eks-add-on\"\n};\nvar layoutProps = {\n  _frontmatter: _frontmatter\n};\nvar MDXLayout = \"wrapper\";\nreturn function MDXContent(_ref) {\n  var components = _ref.components,\n    props = _objectWithoutProperties(_ref, _excluded);\n  return mdx(MDXLayout, _extends({}, layoutProps, props, {\n    components: components,\n    mdxType: \"MDXLayout\"\n  }), mdx(\"h2\", {\n    \"id\": \"table-of-contents\",\n    \"style\": {\n      \"position\": \"relative\"\n    }\n  }, mdx(\"a\", {\n    parentName: \"h2\",\n    \"href\": \"#table-of-contents\",\n    \"aria-label\": \"table of contents permalink\",\n    \"className\": \"anchor before\"\n  }, mdx(\"svg\", {\n    parentName: \"a\",\n    \"aria-hidden\": \"true\",\n    \"focusable\": \"false\",\n    \"height\": \"16\",\n    \"version\": \"1.1\",\n    \"viewBox\": \"0 0 16 16\",\n    \"width\": \"16\"\n  }, mdx(\"path\", {\n    parentName: \"svg\",\n    \"fillRule\": \"evenodd\",\n    \"d\": \"M4 9h1v1H4c-1.5 0-3-1.69-3-3.5S2.55 3 4 3h4c1.45 0 3 1.69 3 3.5 0 1.41-.91 2.72-2 3.25V8.59c.58-.45 1-1.27 1-2.09C10 5.22 8.98 4 8 4H4c-.98 0-2 1.22-2 2.5S3 9 4 9zm9-3h-1v1h1c1 0 2 1.22 2 2.5S13.98 12 13 12H9c-.98 0-2-1.22-2-2.5 0-.83.42-1.64 1-2.09V6.25c-1.09.53-2 1.84-2 3.25C6 11.31 7.55 13 9 13h4c1.45 0 3-1.69 3-3.5S14.5 6 13 6z\"\n  }))), \"Table of Contents\"), mdx(\"h3\", {\n    \"id\": \"introduction\",\n    \"style\": {\n      \"position\": \"relative\"\n    }\n  }, mdx(\"a\", {\n    parentName: \"h3\",\n    \"href\": \"#introduction\",\n    \"aria-label\": \"introduction permalink\",\n    \"className\": \"anchor before\"\n  }, mdx(\"svg\", {\n    parentName: \"a\",\n    \"aria-hidden\": \"true\",\n    \"focusable\": \"false\",\n    \"height\": \"16\",\n    \"version\": \"1.1\",\n    \"viewBox\": \"0 0 16 16\",\n    \"width\": \"16\"\n  }, mdx(\"path\", {\n    parentName: \"svg\",\n    \"fillRule\": \"evenodd\",\n    \"d\": \"M4 9h1v1H4c-1.5 0-3-1.69-3-3.5S2.55 3 4 3h4c1.45 0 3 1.69 3 3.5 0 1.41-.91 2.72-2 3.25V8.59c.58-.45 1-1.27 1-2.09C10 5.22 8.98 4 8 4H4c-.98 0-2 1.22-2 2.5S3 9 4 9zm9-3h-1v1h1c1 0 2 1.22 2 2.5S13.98 12 13 12H9c-.98 0-2-1.22-2-2.5 0-.83.42-1.64 1-2.09V6.25c-1.09.53-2 1.84-2 3.25C6 11.31 7.55 13 9 13h4c1.45 0 3-1.69 3-3.5S14.5 6 13 6z\"\n  }))), mdx(\"a\", {\n    parentName: \"h3\",\n    \"href\": \"/docs/getting-started/adot-eks-add-on#introduction-1\"\n  }, \"Introduction\")), mdx(\"h3\", {\n    \"id\": \"requirements\",\n    \"style\": {\n      \"position\": \"relative\"\n    }\n  }, mdx(\"a\", {\n    parentName: \"h3\",\n    \"href\": \"#requirements\",\n    \"aria-label\": \"requirements permalink\",\n    \"className\": \"anchor before\"\n  }, mdx(\"svg\", {\n    parentName: \"a\",\n    \"aria-hidden\": \"true\",\n    \"focusable\": \"false\",\n    \"height\": \"16\",\n    \"version\": \"1.1\",\n    \"viewBox\": \"0 0 16 16\",\n    \"width\": \"16\"\n  }, mdx(\"path\", {\n    parentName: \"svg\",\n    \"fillRule\": \"evenodd\",\n    \"d\": \"M4 9h1v1H4c-1.5 0-3-1.69-3-3.5S2.55 3 4 3h4c1.45 0 3 1.69 3 3.5 0 1.41-.91 2.72-2 3.25V8.59c.58-.45 1-1.27 1-2.09C10 5.22 8.98 4 8 4H4c-.98 0-2 1.22-2 2.5S3 9 4 9zm9-3h-1v1h1c1 0 2 1.22 2 2.5S13.98 12 13 12H9c-.98 0-2-1.22-2-2.5 0-.83.42-1.64 1-2.09V6.25c-1.09.53-2 1.84-2 3.25C6 11.31 7.55 13 9 13h4c1.45 0 3-1.69 3-3.5S14.5 6 13 6z\"\n  }))), mdx(\"a\", {\n    parentName: \"h3\",\n    \"href\": \"/docs/getting-started/adot-eks-add-on/requirements\"\n  }, \"Requirements\")), mdx(\"h3\", {\n    \"id\": \"installation\",\n    \"style\": {\n      \"position\": \"relative\"\n    }\n  }, mdx(\"a\", {\n    parentName: \"h3\",\n    \"href\": \"#installation\",\n    \"aria-label\": \"installation permalink\",\n    \"className\": \"anchor before\"\n  }, mdx(\"svg\", {\n    parentName: \"a\",\n    \"aria-hidden\": \"true\",\n    \"focusable\": \"false\",\n    \"height\": \"16\",\n    \"version\": \"1.1\",\n    \"viewBox\": \"0 0 16 16\",\n    \"width\": \"16\"\n  }, mdx(\"path\", {\n    parentName: \"svg\",\n    \"fillRule\": \"evenodd\",\n    \"d\": \"M4 9h1v1H4c-1.5 0-3-1.69-3-3.5S2.55 3 4 3h4c1.45 0 3 1.69 3 3.5 0 1.41-.91 2.72-2 3.25V8.59c.58-.45 1-1.27 1-2.09C10 5.22 8.98 4 8 4H4c-.98 0-2 1.22-2 2.5S3 9 4 9zm9-3h-1v1h1c1 0 2 1.22 2 2.5S13.98 12 13 12H9c-.98 0-2-1.22-2-2.5 0-.83.42-1.64 1-2.09V6.25c-1.09.53-2 1.84-2 3.25C6 11.31 7.55 13 9 13h4c1.45 0 3-1.69 3-3.5S14.5 6 13 6z\"\n  }))), mdx(\"a\", {\n    parentName: \"h3\",\n    \"href\": \"/docs/getting-started/adot-eks-add-on/installation\"\n  }, \"Installation\")), mdx(\"h3\", {\n    \"id\": \"add-on-advanced-configuration\",\n    \"style\": {\n      \"position\": \"relative\"\n    }\n  }, mdx(\"a\", {\n    parentName: \"h3\",\n    \"href\": \"#add-on-advanced-configuration\",\n    \"aria-label\": \"add on advanced configuration permalink\",\n    \"className\": \"anchor before\"\n  }, mdx(\"svg\", {\n    parentName: \"a\",\n    \"aria-hidden\": \"true\",\n    \"focusable\": \"false\",\n    \"height\": \"16\",\n    \"version\": \"1.1\",\n    \"viewBox\": \"0 0 16 16\",\n    \"width\": \"16\"\n  }, mdx(\"path\", {\n    parentName: \"svg\",\n    \"fillRule\": \"evenodd\",\n    \"d\": \"M4 9h1v1H4c-1.5 0-3-1.69-3-3.5S2.55 3 4 3h4c1.45 0 3 1.69 3 3.5 0 1.41-.91 2.72-2 3.25V8.59c.58-.45 1-1.27 1-2.09C10 5.22 8.98 4 8 4H4c-.98 0-2 1.22-2 2.5S3 9 4 9zm9-3h-1v1h1c1 0 2 1.22 2 2.5S13.98 12 13 12H9c-.98 0-2-1.22-2-2.5 0-.83.42-1.64 1-2.09V6.25c-1.09.53-2 1.84-2 3.25C6 11.31 7.55 13 9 13h4c1.45 0 3-1.69 3-3.5S14.5 6 13 6z\"\n  }))), mdx(\"a\", {\n    parentName: \"h3\",\n    \"href\": \"/docs/getting-started/adot-eks-add-on/add-on-configuration\"\n  }, \"Add-on Advanced Configuration\")), mdx(\"h3\", {\n    \"id\": \"collector-configuration-introduction\",\n    \"style\": {\n      \"position\": \"relative\"\n    }\n  }, mdx(\"a\", {\n    parentName: \"h3\",\n    \"href\": \"#collector-configuration-introduction\",\n    \"aria-label\": \"collector configuration introduction permalink\",\n    \"className\": \"anchor before\"\n  }, mdx(\"svg\", {\n    parentName: \"a\",\n    \"aria-hidden\": \"true\",\n    \"focusable\": \"false\",\n    \"height\": \"16\",\n    \"version\": \"1.1\",\n    \"viewBox\": \"0 0 16 16\",\n    \"width\": \"16\"\n  }, mdx(\"path\", {\n    parentName: \"svg\",\n    \"fillRule\": \"evenodd\",\n    \"d\": \"M4 9h1v1H4c-1.5 0-3-1.69-3-3.5S2.55 3 4 3h4c1.45 0 3 1.69 3 3.5 0 1.41-.91 2.72-2 3.25V8.59c.58-.45 1-1.27 1-2.09C10 5.22 8.98 4 8 4H4c-.98 0-2 1.22-2 2.5S3 9 4 9zm9-3h-1v1h1c1 0 2 1.22 2 2.5S13.98 12 13 12H9c-.98 0-2-1.22-2-2.5 0-.83.42-1.64 1-2.09V6.25c-1.09.53-2 1.84-2 3.25C6 11.31 7.55 13 9 13h4c1.45 0 3-1.69 3-3.5S14.5 6 13 6z\"\n  }))), mdx(\"a\", {\n    parentName: \"h3\",\n    \"href\": \"/docs/getting-started/adot-eks-add-on/config-collector-intro\"\n  }, \"Collector Configuration Introduction\")), mdx(\"h3\", {\n    \"id\": \"injecting-auto-instrumentation\",\n    \"style\": {\n      \"position\": \"relative\"\n    }\n  }, mdx(\"a\", {\n    parentName: \"h3\",\n    \"href\": \"#injecting-auto-instrumentation\",\n    \"aria-label\": \"injecting auto instrumentation permalink\",\n    \"className\": \"anchor before\"\n  }, mdx(\"svg\", {\n    parentName: \"a\",\n    \"aria-hidden\": \"true\",\n    \"focusable\": \"false\",\n    \"height\": \"16\",\n    \"version\": \"1.1\",\n    \"viewBox\": \"0 0 16 16\",\n    \"width\": \"16\"\n  }, mdx(\"path\", {\n    parentName: \"svg\",\n    \"fillRule\": \"evenodd\",\n    \"d\": \"M4 9h1v1H4c-1.5 0-3-1.69-3-3.5S2.55 3 4 3h4c1.45 0 3 1.69 3 3.5 0 1.41-.91 2.72-2 3.25V8.59c.58-.45 1-1.27 1-2.09C10 5.22 8.98 4 8 4H4c-.98 0-2 1.22-2 2.5S3 9 4 9zm9-3h-1v1h1c1 0 2 1.22 2 2.5S13.98 12 13 12H9c-.98 0-2-1.22-2-2.5 0-.83.42-1.64 1-2.09V6.25c-1.09.53-2 1.84-2 3.25C6 11.31 7.55 13 9 13h4c1.45 0 3-1.69 3-3.5S14.5 6 13 6z\"\n  }))), mdx(\"a\", {\n    parentName: \"h3\",\n    \"href\": \"/docs/getting-started/adot-eks-add-on/config-auto-instrumentation\"\n  }, \"Injecting Auto-instrumentation\")), mdx(\"h3\", {\n    \"id\": \"kubernetes-attributes-processor\",\n    \"style\": {\n      \"position\": \"relative\"\n    }\n  }, mdx(\"a\", {\n    parentName: \"h3\",\n    \"href\": \"#kubernetes-attributes-processor\",\n    \"aria-label\": \"kubernetes attributes processor permalink\",\n    \"className\": \"anchor before\"\n  }, mdx(\"svg\", {\n    parentName: \"a\",\n    \"aria-hidden\": \"true\",\n    \"focusable\": \"false\",\n    \"height\": \"16\",\n    \"version\": \"1.1\",\n    \"viewBox\": \"0 0 16 16\",\n    \"width\": \"16\"\n  }, mdx(\"path\", {\n    parentName: \"svg\",\n    \"fillRule\": \"evenodd\",\n    \"d\": \"M4 9h1v1H4c-1.5 0-3-1.69-3-3.5S2.55 3 4 3h4c1.45 0 3 1.69 3 3.5 0 1.41-.91 2.72-2 3.25V8.59c.58-.45 1-1.27 1-2.09C10 5.22 8.98 4 8 4H4c-.98 0-2 1.22-2 2.5S3 9 4 9zm9-3h-1v1h1c1 0 2 1.22 2 2.5S13.98 12 13 12H9c-.98 0-2-1.22-2-2.5 0-.83.42-1.64 1-2.09V6.25c-1.09.53-2 1.84-2 3.25C6 11.31 7.55 13 9 13h4c1.45 0 3-1.69 3-3.5S14.5 6 13 6z\"\n  }))), mdx(\"a\", {\n    parentName: \"h3\",\n    \"href\": \"/docs/getting-started/adot-eks-add-on/k8s-attr-processor\"\n  }, \"Kubernetes Attributes Processor\")), mdx(\"h3\", {\n    \"id\": \"target-allocator\",\n    \"style\": {\n      \"position\": \"relative\"\n    }\n  }, mdx(\"a\", {\n    parentName: \"h3\",\n    \"href\": \"#target-allocator\",\n    \"aria-label\": \"target allocator permalink\",\n    \"className\": \"anchor before\"\n  }, mdx(\"svg\", {\n    parentName: \"a\",\n    \"aria-hidden\": \"true\",\n    \"focusable\": \"false\",\n    \"height\": \"16\",\n    \"version\": \"1.1\",\n    \"viewBox\": \"0 0 16 16\",\n    \"width\": \"16\"\n  }, mdx(\"path\", {\n    parentName: \"svg\",\n    \"fillRule\": \"evenodd\",\n    \"d\": \"M4 9h1v1H4c-1.5 0-3-1.69-3-3.5S2.55 3 4 3h4c1.45 0 3 1.69 3 3.5 0 1.41-.91 2.72-2 3.25V8.59c.58-.45 1-1.27 1-2.09C10 5.22 8.98 4 8 4H4c-.98 0-2 1.22-2 2.5S3 9 4 9zm9-3h-1v1h1c1 0 2 1.22 2 2.5S13.98 12 13 12H9c-.98 0-2-1.22-2-2.5 0-.83.42-1.64 1-2.09V6.25c-1.09.53-2 1.84-2 3.25C6 11.31 7.55 13 9 13h4c1.45 0 3-1.69 3-3.5S14.5 6 13 6z\"\n  }))), mdx(\"a\", {\n    parentName: \"h3\",\n    \"href\": \"/docs/getting-started/adot-eks-add-on/target-allocator\"\n  }, \"Target Allocator\")), mdx(\"h3\", {\n    \"id\": \"update-and-cleanup\",\n    \"style\": {\n      \"position\": \"relative\"\n    }\n  }, mdx(\"a\", {\n    parentName: \"h3\",\n    \"href\": \"#update-and-cleanup\",\n    \"aria-label\": \"update and cleanup permalink\",\n    \"className\": \"anchor before\"\n  }, mdx(\"svg\", {\n    parentName: \"a\",\n    \"aria-hidden\": \"true\",\n    \"focusable\": \"false\",\n    \"height\": \"16\",\n    \"version\": \"1.1\",\n    \"viewBox\": \"0 0 16 16\",\n    \"width\": \"16\"\n  }, mdx(\"path\", {\n    parentName: \"svg\",\n    \"fillRule\": \"evenodd\",\n    \"d\": \"M4 9h1v1H4c-1.5 0-3-1.69-3-3.5S2.55 3 4 3h4c1.45 0 3 1.69 3 3.5 0 1.41-.91 2.72-2 3.25V8.59c.58-.45 1-1.27 1-2.09C10 5.22 8.98 4 8 4H4c-.98 0-2 1.22-2 2.5S3 9 4 9zm9-3h-1v1h1c1 0 2 1.22 2 2.5S13.98 12 13 12H9c-.98 0-2-1.22-2-2.5 0-.83.42-1.64 1-2.09V6.25c-1.09.53-2 1.84-2 3.25C6 11.31 7.55 13 9 13h4c1.45 0 3-1.69 3-3.5S14.5 6 13 6z\"\n  }))), mdx(\"a\", {\n    parentName: \"h3\",\n    \"href\": \"/docs/getting-started/adot-eks-add-on/update-and-cleanup\"\n  }, \"Update and Cleanup\")), mdx(\"h3\", {\n    \"id\": \"troubleshooting\",\n    \"style\": {\n      \"position\": \"relative\"\n    }\n  }, mdx(\"a\", {\n    parentName: \"h3\",\n    \"href\": \"#troubleshooting\",\n    \"aria-label\": \"troubleshooting permalink\",\n    \"className\": \"anchor before\"\n  }, mdx(\"svg\", {\n    parentName: \"a\",\n    \"aria-hidden\": \"true\",\n    \"focusable\": \"false\",\n    \"height\": \"16\",\n    \"version\": \"1.1\",\n    \"viewBox\": \"0 0 16 16\",\n    \"width\": \"16\"\n  }, mdx(\"path\", {\n    parentName: \"svg\",\n    \"fillRule\": \"evenodd\",\n    \"d\": \"M4 9h1v1H4c-1.5 0-3-1.69-3-3.5S2.55 3 4 3h4c1.45 0 3 1.69 3 3.5 0 1.41-.91 2.72-2 3.25V8.59c.58-.45 1-1.27 1-2.09C10 5.22 8.98 4 8 4H4c-.98 0-2 1.22-2 2.5S3 9 4 9zm9-3h-1v1h1c1 0 2 1.22 2 2.5S13.98 12 13 12H9c-.98 0-2-1.22-2-2.5 0-.83.42-1.64 1-2.09V6.25c-1.09.53-2 1.84-2 3.25C6 11.31 7.55 13 9 13h4c1.45 0 3-1.69 3-3.5S14.5 6 13 6z\"\n  }))), mdx(\"a\", {\n    parentName: \"h3\",\n    \"href\": \"/docs/getting-started/adot-eks-add-on/troubleshooting\"\n  }, \"Troubleshooting\")), mdx(\"h2\", {\n    \"id\": \"introduction-1\",\n    \"style\": {\n      \"position\": \"relative\"\n    }\n  }, mdx(\"a\", {\n    parentName: \"h2\",\n    \"href\": \"#introduction-1\",\n    \"aria-label\": \"introduction 1 permalink\",\n    \"className\": \"anchor before\"\n  }, mdx(\"svg\", {\n    parentName: \"a\",\n    \"aria-hidden\": \"true\",\n    \"focusable\": \"false\",\n    \"height\": \"16\",\n    \"version\": \"1.1\",\n    \"viewBox\": \"0 0 16 16\",\n    \"width\": \"16\"\n  }, mdx(\"path\", {\n    parentName: \"svg\",\n    \"fillRule\": \"evenodd\",\n    \"d\": \"M4 9h1v1H4c-1.5 0-3-1.69-3-3.5S2.55 3 4 3h4c1.45 0 3 1.69 3 3.5 0 1.41-.91 2.72-2 3.25V8.59c.58-.45 1-1.27 1-2.09C10 5.22 8.98 4 8 4H4c-.98 0-2 1.22-2 2.5S3 9 4 9zm9-3h-1v1h1c1 0 2 1.22 2 2.5S13.98 12 13 12H9c-.98 0-2-1.22-2-2.5 0-.83.42-1.64 1-2.09V6.25c-1.09.53-2 1.84-2 3.25C6 11.31 7.55 13 9 13h4c1.45 0 3-1.69 3-3.5S14.5 6 13 6z\"\n  }))), \"Introduction\"), mdx(\"p\", null, \"Welcome to the getting started guide for AWS Distro for OpenTelemetry (ADOT) using Elastic Kubernetes Service (EKS) add-ons. This guide shows you how to leverage Amazon EKS add-ons to install and manage ADOT within your Amazon EKS cluster. \", mdx(\"a\", {\n    parentName: \"p\",\n    \"href\": \"https://aws-otel.github.io/\"\n  }, \"ADOT\"), \" is generally available (GA) for tracing and can also be used for metrics. Amazon EKS add-ons support for ADOT enables a simplified experience through EKS APIs to install one component of ADOT, the \", mdx(\"a\", {\n    parentName: \"p\",\n    \"href\": \"/docs/getting-started/adot-eks-add-on#the-adot-operator-and-adot-collector\"\n  }, \"ADOT Operator\"), \", in your Amazon EKS cluster for your metrics and/or trace collection pipeline. Amazon EKS add-ons support reduces the amount of configuration, setup, and deployment that would be required otherwise. For more information, see \", mdx(\"a\", {\n    parentName: \"p\",\n    \"href\": \"https://docs.aws.amazon.com/eks/latest/userguide/eks-add-ons.html\"\n  }, \"Amazon EKS add-ons\"), \".\"), mdx(\"p\", null, \"This guide contains:\"), mdx(\"ul\", null, mdx(\"li\", {\n    parentName: \"ul\"\n  }, \"Requirements to install ADOT\"), mdx(\"li\", {\n    parentName: \"ul\"\n  }, \"How to install the ADOT using Amazon EKS add-ons.\"), mdx(\"li\", {\n    parentName: \"ul\"\n  }, \"How to set up the ADOT Operator and Collector.\"), mdx(\"li\", {\n    parentName: \"ul\"\n  }, \"How to instrument your applications on Amazon EKS.\"), mdx(\"li\", {\n    parentName: \"ul\"\n  }, \"How to configure the ADOT Collector to collect, and send infrastructure and application metrics from Amazon EKS clusters and applications to either Amazon Managed Service for Prometheus or CloudWatch.\"), mdx(\"li\", {\n    parentName: \"ul\"\n  }, \"How to configure an ADOT Collector to collect and send application traces from workloads running on Amazon EKS to AWS X-Ray.\"), mdx(\"li\", {\n    parentName: \"ul\"\n  }, \"How to update the ADOT EKS add-on\")), mdx(\"p\", null, \"This diagram shows an end-to-end pipeline utilizing the ADOT EKS add-on. It breaks down the different components of the pipeline, as well as splits it up into three smaller pipelines; those three pipelines are configured for:\"), mdx(\"ul\", null, mdx(\"li\", {\n    parentName: \"ul\"\n  }, \"Discovering and collecting Prometheus metrics and sending to Amazon Managed Service for Prometheus (AMP)\"), mdx(\"li\", {\n    parentName: \"ul\"\n  }, \"Receiving OTLP metrics, and sending to Amazon Managed Service for Prometheus (AMP) and Amazon CloudWatch\"), mdx(\"li\", {\n    parentName: \"ul\"\n  }, \"Receiving distributed application traces, and sending them to AWS X-Ray\")), mdx(\"img\", {\n    src: operatorImg2,\n    alt: \"Diagram\",\n    style: {\n      \"margin\": \"30px 0\"\n    }\n  }), mdx(\"p\", {\n    style: {\n      \"textAlign\": \"center\"\n    }\n  }, mdx(\"i\", null, \"Diagram: EKS ADOT Operator end to end pipeline\")), mdx(\"h2\", {\n    \"id\": \"the-adot-operator-and-adot-collector\",\n    \"style\": {\n      \"position\": \"relative\"\n    }\n  }, mdx(\"a\", {\n    parentName: \"h2\",\n    \"href\": \"#the-adot-operator-and-adot-collector\",\n    \"aria-label\": \"the adot operator and adot collector permalink\",\n    \"className\": \"anchor before\"\n  }, mdx(\"svg\", {\n    parentName: \"a\",\n    \"aria-hidden\": \"true\",\n    \"focusable\": \"false\",\n    \"height\": \"16\",\n    \"version\": \"1.1\",\n    \"viewBox\": \"0 0 16 16\",\n    \"width\": \"16\"\n  }, mdx(\"path\", {\n    parentName: \"svg\",\n    \"fillRule\": \"evenodd\",\n    \"d\": \"M4 9h1v1H4c-1.5 0-3-1.69-3-3.5S2.55 3 4 3h4c1.45 0 3 1.69 3 3.5 0 1.41-.91 2.72-2 3.25V8.59c.58-.45 1-1.27 1-2.09C10 5.22 8.98 4 8 4H4c-.98 0-2 1.22-2 2.5S3 9 4 9zm9-3h-1v1h1c1 0 2 1.22 2 2.5S13.98 12 13 12H9c-.98 0-2-1.22-2-2.5 0-.83.42-1.64 1-2.09V6.25c-1.09.53-2 1.84-2 3.25C6 11.31 7.55 13 9 13h4c1.45 0 3-1.69 3-3.5S14.5 6 13 6z\"\n  }))), \"The ADOT Operator and ADOT Collector\"), mdx(\"p\", null, \"When you leverage EKS add-ons, EKS will install the ADOT Operator. The ADOT Operator is an implementation of a \", mdx(\"a\", {\n    parentName: \"p\",\n    \"href\": \"https://cloud.redhat.com/learn/topics/operators\"\n  }, \"Kubernetes Operator\"), \", a method of packaging and deploying a Kubernetes-native application and managed using Kubernetes APIs. In this case, the application is the ADOT Collector, which is a collection agent that receives, processes, and exports telemetry data in multiple data formats to multiple open source and vendor-service backends. A Kubernetes Operator is a custom controller, which uses a \", mdx(\"a\", {\n    parentName: \"p\",\n    \"href\": \"https://kubernetes.io/docs/tasks/extend-kubernetes/custom-resources/custom-resource-definitions/\"\n  }, \"Custom Resource Definition (CRD)\"), \" to simplify the deployment and configuration of Custom Resources (CR). The ADOT Operator introduces a new CR called the \", mdx(\"inlineCode\", {\n    parentName: \"p\"\n  }, \"OpenTelemetryCollector\"), \" through a CRD.\"), mdx(\"p\", null, \" The ADOT Operator detects the presence of or changes for the \", mdx(\"inlineCode\", {\n    parentName: \"p\"\n  }, \"OpenTelemetryCollector\"), \" resource. For any such change, the ADOT Operator performs the following actions:\"), mdx(\"ol\", null, mdx(\"li\", {\n    parentName: \"ol\"\n  }, \"Verifies that all the required connections for these creation, update, or deletion requests to the Kubernetes API server are available. \"), mdx(\"li\", {\n    parentName: \"ol\"\n  }, \"Deploys ADOT Collector instances in the way the user expressed in the \", mdx(\"inlineCode\", {\n    parentName: \"li\"\n  }, \"OpenTelemetryCollector\"), \" resource configuration. \")), mdx(\"p\", null, \"The diagram below shows how the Collector CR request flows from the customer to the ADOT Operator to deploy the ADOT Collector.\"), mdx(\"img\", {\n    src: operatorImg1,\n    alt: \"Diagram\",\n    style: {\n      \"margin\": \"30px 0\"\n    }\n  }), mdx(\"p\", null, \"You can leverage EKS add-ons to maintain the ADOT Operator. The ADOT Collector is released and supported through regular ADOT releases on \", mdx(\"a\", {\n    parentName: \"p\",\n    \"href\": \"https://aws.amazon.com/ecr/\"\n  }, \"Amazon Elastic Container Registry (Amazon ECR)\"), \" public gallery. If you want to update your ADOT Collector version to the latest release, apply a new configuration via CRD with an updated image. You can ask questions and report bugs on \", mdx(\"a\", {\n    parentName: \"p\",\n    \"href\": \"https://github.com/aws-observability/aws-otel-community/issues\"\n  }, \"GitHub\"), \".\"), mdx(\"p\", null, \"See \", mdx(\"a\", {\n    parentName: \"p\",\n    \"href\": \"/docs/getting-started/adot-eks-add-on/update-and-cleanup\"\n  }, \"this section\"), \" to update these components.\"), mdx(\"h2\", {\n    \"id\": \"next-topic-requirements\",\n    \"style\": {\n      \"position\": \"relative\"\n    }\n  }, mdx(\"a\", {\n    parentName: \"h2\",\n    \"href\": \"#next-topic-requirements\",\n    \"aria-label\": \"next topic requirements permalink\",\n    \"className\": \"anchor before\"\n  }, mdx(\"svg\", {\n    parentName: \"a\",\n    \"aria-hidden\": \"true\",\n    \"focusable\": \"false\",\n    \"height\": \"16\",\n    \"version\": \"1.1\",\n    \"viewBox\": \"0 0 16 16\",\n    \"width\": \"16\"\n  }, mdx(\"path\", {\n    parentName: \"svg\",\n    \"fillRule\": \"evenodd\",\n    \"d\": \"M4 9h1v1H4c-1.5 0-3-1.69-3-3.5S2.55 3 4 3h4c1.45 0 3 1.69 3 3.5 0 1.41-.91 2.72-2 3.25V8.59c.58-.45 1-1.27 1-2.09C10 5.22 8.98 4 8 4H4c-.98 0-2 1.22-2 2.5S3 9 4 9zm9-3h-1v1h1c1 0 2 1.22 2 2.5S13.98 12 13 12H9c-.98 0-2-1.22-2-2.5 0-.83.42-1.64 1-2.09V6.25c-1.09.53-2 1.84-2 3.25C6 11.31 7.55 13 9 13h4c1.45 0 3-1.69 3-3.5S14.5 6 13 6z\"\n  }))), mdx(\"a\", {\n    parentName: \"h2\",\n    \"href\": \"/docs/getting-started/adot-eks-add-on/requirements\"\n  }, \"Next Topic: Requirements\")));\n}\n;\nMDXContent.isMDXComponent = true;","headings":[{"depth":2,"value":"Table of Contents"},{"depth":3,"value":"Introduction"},{"depth":3,"value":"Requirements"},{"depth":3,"value":"Installation"},{"depth":3,"value":"Add-on Advanced Configuration"},{"depth":3,"value":"Collector Configuration Introduction"},{"depth":3,"value":"Injecting Auto-instrumentation"},{"depth":3,"value":"Kubernetes Attributes Processor"},{"depth":3,"value":"Target Allocator"},{"depth":3,"value":"Update and Cleanup"},{"depth":3,"value":"Troubleshooting"},{"depth":2,"value":"Introduction"},{"depth":2,"value":"The ADOT Operator and ADOT Collector"},{"depth":2,"value":"Next Topic: Requirements"}]}},"pageContext":{"slug":"/docs/getting-started/adot-eks-add-on/","repositoryEditUrl":"https://github.com/rocketseat/gatsby-themes/tree/main/examples/gatsby-theme-docs/src/docs/getting-started/adot-eks-add-on.mdx","repositoryProvider":"GitHub"}},
    "staticQueryHashes": ["2501019404","973074209"]}